id;title;body;department;sentiment
109;Ristorante sotto le aspettative;Prenotammo un tavolo per la cena aspettandoci qualcosa di speciale. Il ristorante deluse: menu limitato, piatti tiepidi e personale F&B distratto. La colazione del giorno dopo fu appena sufficiente.;F&B;negative
110;Pulizia zeroo!! #cammera sporca!!$$;Ma che schifo trovammo in quella cammera!!?? Pavimento mai lavato, asciugamani usati lasciati lì dal giorno prima e macchie sul copriletto. HO FOTOGRAFATO TUTTO!! @hotelmanagement vergogna!!;Housekeeping;negative
111;Ristorante ottimo ma reception disorganizzata;La colazione al ristorante era genuinamente eccellente: prodotti freschi, atmosfera piacevole e personale F&B attento. Peccato che il check-in avesse creato confusione con le camere assegnate.;Reception;negative
112;Reception impeccabile ma ristorante deludente;La receptionist ci accolse con calore e il check-in fu sbrigato in meno di tre minuti. Tuttavia la cena al ristorante quella stessa sera fu mediocre e la colazione appena tollerabile.;Reception;positive
113;Buffet eccellente ma pulizia trascurata;Il ristorante a colazione offriva una selezione straordinaria: formaggi artigianali, frutta di stagione e caffè eccellente. Il reparto F&B era il fiore all'occhiello. La pulizia camera invece deludeva: bagno con aloni e pavimento appiccicoso.;F&B;positive
114;Pulizia al top, ma meglio cenare fuori;La colazzione era scadente e il ristorante a cena non andava meglio: piatti freddi e personale F&B svogliato. La pulizia camera tuttavia era meticolosa: ogni giorno trovavamo tutto perfettamente riordinato.;F&B;negative
115;Ambiente curato grazie all'ottimo housekeeping;L'anno scorso in questo hotel la pulizia camera era nella media. Quest'anno invece il reparto housekeeping ha fatto un salto di qualità notevole: dettagli curati e profumo fresco ogni giorno.;Housekeeping;positive
116;RICETIONIST MALEDUCATA E LENTA!!??;Qual'è il problema di rispondere con gentilezza?? La tipa alla ricezzione sembrava scocciata di esistere. Il check-out mi ha rubato mezz'ora di vita per un errore SUO. INACCETTABILE!!$$ #receptionhorror;Reception;negative
117;Pranzo al ristorante da incorniciare;Oggi a pranzo il ristorante ha superato ogni aspettativa: pasta fresca al ragù, dessert artigianale e un personale F&B che anticipava ogni nostra necessità. Torneremo solo per mangiare.;F&B;positive
118;Pulizia della camera lascia a desiderare;Segnalai due volte alla reception che gli asciugamani non erano stati cambiati. Il personale housekeeping intervenì solo al terzo giorno. La pulizia camera era chiaramente non prioritaria.;Housekeeping;negative
119;Check-in fluido e ben organizzato;Arrivammo con un'ora di anticipo sul check-in previsto e la reception riuscì comunque ad assegnarci la camera immediatamente. Professionalità rara che vale la pena riconoscere.;Reception;positive
120;Servvizio F&B indegno di un 4 stelle!!;Aspettammo quarantacinque minuti per una colazzione mediocre!! Il ristorante era semivuoto eppure il personale F&B ignorava i clienti. Prezzo esagerato!!$$ *SCANDALOSO* #ciboorribile;F&B;negative
121;Soggiorno memorabile grazie anche al reparto pulizie;Durante le vacanze di primavera ho soggiornato qui per cinque notti. La pulizia camera era impeccabile ogni giorno: lenzuola fresche, bagno profumato e piccoli dettagli che facevano sentire a casa.;Housekeeping;positive
122;Personale reception formato e premuroso;Oggi ho avuto un problema con il riscaldamento della camera e la reception ha inviato la manutenzione in meno di dieci minuti. Reattività e cortesia esemplari.;Reception;positive
123;Colazione fredda e ristoarnte trascurato;Il ristoarnte a colazione offriva prodotti di bassa qualità disposti in modo sciatto. Il caffè era annacquato e le uova strapazzate sembravano di ieri. Delusione totale per il prezzo pagato.;F&B;negative
124;CAMERA SPORCA SPORCA SPORCA!!!;#inaccettabbile La pulizia zeroo era evidente dal primo sguardo: macchie sul cuscino, WC non pulito e un capello nella doccia. HO CHIAMATO TRE VOLTE la ricetionist senza risultato!! VERGOGNA!!$$;Housekeeping;negative
125;Qualità costante dal ristorante;Ogni mattina la colazione al ristorante confermava lo stesso standard elevato: prodotti freschi, varietà ampia e personale F&B sempre disponibile. Una certezza che rende il soggiorno piacevole.;F&B;positive
126;Pulizia camera eccellente ogni mattina;Rientravo in camera ogni pomeriggio e trovavo tutto perfettamente riordinato. La pulizia camera era meticolosa: lenzuola tese, bagno profumato e asciugamani freschi puntualmente.;Housekeeping;positive
127;CHECK-IN CAOTICO E RICETIONIST ASSENTE!!;Arrivammo dopo sei ore di viaggio e trovammo il bancone della reception VUOTO per dieci minuti. Quando finalmente apparve la ricetionist ci consegnò la chiave sbagliata. INACCETTABILE!!$$ #frontdeskzero;Reception;negative
128;Colazione abbondante e ben curata;Ogni mattina il buffet del ristorante offriva una selezione generosa di prodotti freschi. Il personale F&B era attento e riforniva i vassoi senza aspettare che si svuotassero. Ottima gestione.;F&B;positive
129;Asciugamani non cambiati per tre giorni;Richiedemmo più volte il cambio degli asciugamani ma l'housekeeping interveniva solo dopo insistenti telefonate. La pulizia cammera era superficiale e discontinua. Situazione migliorata solo all'ultimo giorno.;Housekeeping;negative
130;Receptionist attenta e disponibile;Oggi ho chiesto alla reception di organizzare una visita guidata in città e il personale si è occupato di tutto in pochi minuti e ieri all'arrivo in serata sono stati rapidissimi. Servizio encomiabile. Mi hanno anche aiutato a fare i biglietti per il ritorno.;Reception;positive
131;Ristorante sconsigliato, cibo pessimo e poco curato;La cena al ristorante era composta da piatti freddi e mal conditi. Ho ordinato una bistecca che effettivamente era diventata la suola di una scarpa.La colazione del mattino seguente non migliorò le cose: prodotti confezionati e caffè mediocre. Il personale sembrava non ci fosse.;F&B;negative
132;TUTTO MAGNIFICO!! #stellecinque;Non mi aspettavo tanta cura: la pulizia camera era PERFETTA ogni singolo giorno!! Origami di asciugamani sul letto, pavimento LUCIDISSIMO e scorte di cortesia sempre rifornite!! @hotelstaff GRAZIE!!;Housekeeping;positive
133;Nessun problema al check-out stamattina;Il check-out è durato letteralmente due minuti: fattura corretta al primo colpo, bagagli custoditi con cura e personale sorridente fino all'ultimo. Reception da manuale.;Reception;positive
134;Menu ripetitivo in questo ristoraante;Per quattro giorni consecutivi quello che abbiamo mangiato e cio che ci e' stato proposto dal  il ristoraante erano gli stessi tre piatti principali. Al primo mattino La colazione variava a malapena Tutto era commestibile e mangiabile  ma privo di fantasia. I ragazzi sono stati gentili,ma quanto lo cambiate questo menu'?;F&B;negative
135;Pulizia zeroo!! vamera uno schifo!!$$;#disgustoso Trovai la vamera con macchie evidenti sul copriletto e il WC non sanificato. Chiamai la ricetionist che promise intervento IMMEDIATO ma nessuno si presentò!! MAI PIÙ in questo posto!!;Housekeeping;negative
136;Ristorante eccellente ma reception da rivedere;La colazione al ristorante era di altissimo livello ogni mattina e il personale F&B ci ha viziati con prodotti locali e caffè aromatico. Il check-in però aveva creato confusione con le assegnazioni.;Reception;negative
137;Check-out perfetto ma cibo pessimo;La reception ha gestito il check-out con rapidità e professionalità esemplari. Purtroppo la colazione quella mattina era scadente e la cena del giorno prima al ristorante era stata altrettanto deludente.;Reception;positive
138;Colazione TOP ma pulizia camera trascurata;Il ristorante a colazione era semplicemente straordinario: frutta fresca, uova preparate al momento e personale F&B premuroso. La pulizia camera invece deludeva: bagno con residui e pavimento non lavato.;F&B;positive
139;Cibo mediocre ma personale impeccabile;La colazzione era appena sufficiente e il ristorante a cena non convinceva: porzioni scarse e piatti anonimi. Il reparto pulizie però eccelleva: camera sempre in ordine e dettagli curati ogni giorno.;F&B;negative
140;Servizio pulizie finalmente all'altezza;L'ultima volta che soggiornai qui la pulizia camera era deludente. Stavolta invece mi devo riceredere,ha sorpreso positivamente tutto : bagno sanificato ogni giorno e lenzuola morbidisse e pulitssiime cambiate a metà soggiorno senza richiederlo.;Housekeeping;positive
141;RICETIONIST INCOMPETENTE!! ATTESA ASSURDA!!??;Qual'è il senso di avere un sistema di prenotazione online se poi la ricetionist al check-in non trova NIENTE?? Aspettai trenta minuti mentre lei digitava freneticamente. Servvizio ZERO!!$$ #caosreception;Reception;negative
142;Pranzo al ristorante una piacevole sorpresa;Non avevo grandi aspettative per il ristorante dell'hotel ma il pranzo di oggi mi ha completamente ricreduto: piatti regionali ben eseguiti e personale F&B competente. La colazione di domani la aspetto con curiosità.;F&B;positive
143;Pulizia camera nella media senza sorprese;Durante i tre giorni di soggiorno , le ragazze e i ragazzi addetti  hanno svolto il proprio lavoro in modo regolare. Niente di straordinario ma nemmeno niente di negativo: asciugamani cambiati e bagno decente in generale.;Housekeeping;positive
144;Colazzione fredda e servvizio assente!!;Stamattina la colazzione era un disastro: cornetti di ieri, caffè tiepido e nessun prodotto fresco. Il ristorante era sporco e il personale F&B IGNORAVA i clienti. Prezzo esagerato!!$$ *VERGOGNA*;F&B;negative
145;Personale reception formato e reattivo;Arrivai con una prenotazione modificata all'ultimo minuto e la reception gestì la situazione senza alcun intoppo. Professionalità e calma anche sotto pressione. Davvero un ottimo front desk.;Reception;positive
146;Camera abbandonata a se stessa;Durante il soggiorno di febbraio scorso notai che la pulizia cammera veniva eseguita ogni due giorni e in modo frettoloso. Il bagno aveva sempre aloni sullo specchio e il pavimento non sembrava mai lavato. La governante, effettivamente , non era presente.;Housekeeping;negative
147;Ristorante dell'hotel consigliato;La colazione era ricca e curata ogni mattina. L a cena offriva un menu interessante con prodotti di stagione e devo dire che ogni piatto veniva spiegato in modo professionale dai camerieri. Esperienza gastronomica sopra la media.;F&B;positive
148;CHECK-IN DURATO UN'ORA INTERA!!;Ma stiamo scherzando??!!! Il check-in di ieri sera è durato SESSANTA MINUTI perché il sistema della ricezzione era in panne. Nessuno si è scusato e ci hanno dato una cammera diversa da quella prenotata. INACCETTABILE!!;Reception;negative
149;Personale delle pulizie puntuale e discreto;Ogni mattina entro le dieci la camera era già perfettamente riassettata. La pulizia camera era garantita dalla governante senza mai dover richiedere interventi. Personale discreto e professionale.;Housekeeping;positive
150;Qualità del ristorante costante e affidabile;Sia a colazione che a cena il ristorante ha mantenuto un livello elevato per tutta la durata del soggiorno. Il personale F&B era attento e la qualità degli ingredienti si sentiva in ogni piatto.;F&B;positive
151;Ordine e pulizia garantiti ogni giorno;Rientravamo in camera ogni sera trovando tutto perfettamente riassettato. La pulizia camera era costante e accurata per tutta la durata del soggiorno. Personale housekeeping discreto e professionale.;Housekeeping;positive
152;Attesa infinita per registrarsi ,FILA ASSURDA AL CHECKIN!!$$;Mezz'ora in piedi davanti al bancone con UN SOLO ricetionist per dieci persone. Il checkin era COMPLETAMENTE disorganizzato e nessuno si degnò di scusarsi, azni ci dissero pure che potevamo aspettare di piu, deluso. #frontdeskfail MAI PIÙ!!;Reception;negative
153;Cena al ristorante da ricordare;Ieri sera il ristorante ha espresso il meglio della cucina locale: ingredienti freschi, presentazione curata e personale F&B che anticipava ogni nostra richiesta. La colazione stamattina era altrettanto buona.;F&B;positive
154;Bagno non sanificato nemmeno una volta;Segnalai alla ricetionist che il bagno della cammera non era stato pulito correttamente. Mi promise un intervento immediato che non arrivò mai. La pulizia zeroo era evidente dal primo giorno. Ho riscontrato una scarsa attenzione ai dettagli, sui comodini c'è uno strato grigio di polvere evidente e i vetri della finestra sono pieni di impronte.;Housekeeping;negative
155;Receptionist competente e veloce;Oggi il check-out è stato gestito in meno di tre minuti: fattura corretta, bagagli custoditi senza problemi. Raramente ho trovato una reception così efficiente, un applauso ai ragazzi e al direttore che li gestisce.;Reception;positive
156;Colazzione appena sufficiente e mal allestita;Il buffet della colazzione offriva prodotti di qualità scadente disposti in modo sciatto. Il ristorante era rumoroso e il personale F&B sembrava sopraffatto anche con pochi ospiti presenti.;F&B;negative
157;PULIZIA CAMERA INCREDIBILE!! #wow;#topqualità La pulizia camera era STRAORDINARIA ogni singolo giorno: pavimento LUCENTISSIMO, asciugamani piegati a ventaglio e scorte di cortesia sempre rifornite puntualmente!! @hotelmanagement OTTIMO LAVORO!!;Housekeeping;positive
158;Check-in fluido nonostante l'affollamento;Arrivammo durante il weekend con l'hotel al completo. Nonostante la fila la reception gestì ogni cliente con calma e professionalità. Il check-in si concluse in tempi rapidi e mi portò molta gioia e felicità come prima senszione per questa vacanza.;Reception;positive
159;Ristorante deludente su tutta la linea;Sia la cena che la colazione al ristorante furono esperienze mediocri: piatti tiepidi, porzioni ridotte e personale F&B distratto. Per il prezzo richiesto mi aspettavo decisamente di più.;F&B;negative
160;Sporcizzia!! cammera uno schifo totale!!;#inaccettabbile Trovammo la cammera con capelli nella doccia e macchie sul copriletto. HO FOTOGRAFATO TUTTO e mandato mail alla direzione!! La ricetionist si scusò ma NON cambiò niente!! VERGOGNA!!$$;Housekeeping;negative
161;Colazione ottima ma reception lenta;Il ristorante a colazione era eccellente: prodotti locali freschi e personale F&B sorridente ogni mattina. Purtroppo il check-in della sera prima aveva richiesto quaranta minuti per un problema di sistema.;Reception;negative
162;Reception perfetta ma rristorante da dimenticare;La receptionist ci accolse con calore e professionalità e il check-in filò liscio in pochi minuti. La cena al ristorante quella sera fu però deludente e la colazione del giorno dopo appena tollerabile.;Reception;positive
163;Ristorante top ma camera assolutamente no;La colazione al ristorante era di altissimo livello: formaggi artigianali, frutta di stagione e caffè eccellente. Il personale F&B era il vero punto di forza. La pulizia camera invece deludeva: pavimento appiccicoso e specchio con aloni.;F&B;positive
164;Cibo pessimo ma pulizie impeccabili;La colazzione era scadente e il ristorante a cena non andava meglio: menu limitato e servvizio lento. La pulizia camera però era meticolosa ogni giorno: lenzuola fresche e bagno sempre sanificato.;F&B;negative
165;Stesse sensazioni di un tempo;Due anni fa questo hotel aveva un reparto pulizie eccellente poi peggiorato. Felice di constatare che la pulizia camera è tornata agli standard di una volta: tutto impeccabile per  le nostre cinque giornate consecutive qui.;Housekeeping;positive
166;RICETIONIST SGARBATA!! CHECKOUT DISASTROSO!!??;Qual'è il senso di un front desk aperto 24h se il personale è maleducato?? La ricetionist al check-out mi ha risposto male per un addebito SBAGLIATO sul conto!! Servvizio ZERO!!$$ #receptionhorror @direzione;Reception;negative
167;Pranzo al ristorante una vera sorpresa;Non avevo grandi aspettative ma il pranzo di oggi al ristorante mi ha completamente convinto: piatti regionali ben eseguiti e personale F&B preparato e gentile. Tornerò sicuramente.;F&B;positive
168;Camera in ordine ma senza particolari cure;La pulizia camera era regolare durante tutto il soggiorno: niente di straordinario ma tutto nella norma. Asciugamani cambiati ogni due giorni e bagno mantenuto in condizioni accettabili.;Housekeeping;positive
169;Colazzione immangiabille!! *ORRENDA*;Stamattina la colazzione era composta da roba confezionata di bassa qualità. Il ristorante aveva un odore sgradevole e il caffè era ACQUA SPORCA!! Prezzo esagerato!!$$ #ciboorribile @hotelmanagement vergogna;F&B;negative
170;Personale reception gentile e preparato;Arrivai con una prenotazione modificata all'ultimo momento e la reception gestì la situazione con calma e competenza. Check-in completato in pochi minuti nonostante la complicazione.;Reception;positive
171;Personalle dpendente discontinuo e poco affidabile;Durante il soggiorno di marzo scorso la pulizia camera veniva effettuata a giorni alterni e in modo frettoloso. Il bagno aveva sempre residui visibili e gli asciugamani non venivano cambiati puntualmente.;Housekeeping;negative
172;Buffet della colazione sempre all'altezza;Ogni mattina il ristorante confermava lo stesso standard elevato: selezione ampia, prodotti freschi e personale F&B premuroso. Una certezza che rendeva ogni giornata piacevole fin dall'inizio.;F&B;positive
173;CHECK-OUT UN DISASTRO COMPLETO!!;Il check-out di stamattina ha richiesto QUARANTACINQUE MINUTI per un errore della ricetionist sul conto. Nessuno si è scusato e ho perso il treno!! INACCETTABILE per un hotel di questa categoria!!$$;Reception;negative
174;Dettagli curati dal reparto pulizie;Ogni mattina trovavo la camera perfettamente in ordine con piccoli dettagli che dimostravano cura: asciugamani piegati con precisione e scorte di cortesia sempre rifornite. Personale housekeeping davvero attento.;Housekeeping;positive
175;Qualità del ristorante sempre costante;Sia a colazione che a cena il ristorante ha mantenuto un livello elevato per tutte e sei le notti del soggiorno. Il personale F&B era competente e la qualità degli ingredienti si sentiva ad ogni pasto.;F&B;positive
176;Standard di pulizia molto alto;Ogni mattina rientravo in una camera impeccabile: lenzuola fresche, bagno sanificato e asciugamani cambiati puntualmente. Il reparto housekeeping ha lavorato con costanza per tutto il soggiorno.;Housekeeping;positive
177;ATTESA INFINITA AL BANCONE!!$$;Tre ricetionist dietro al bancone e nessuno ci guardava!! Il check-in durò quaranta minuti per un errore di sistema MAI risolto correttamente. SCANDALOSO per un hotel a quattro stelle!! #receptionzero;Reception;negative
178;Sapori genuini e delizioni al ristorante;Ieri sera la cena al ristorante ci ha piacevolmente sorpresi: piatti regionali ben eseguiti, ingredienti freschi e persole di cucina altamente preparato poiché il mio palato ha apprezzato ogni singola portata. La colazione stamattina era altrettanto curata. Amo la loro spremuta;F&B;positive
179;Cammera non pulita nemmeno il primo giorno;Aprimmo la vamera e trovammo immediatamente residui sul lavandino e capelli nella doccia. La pulizia cammera era chiaramente stata saltata. Segnalai tutto ma l'intervento arrivò solo il giorno seguente.;Housekeeping;negative
180;Personale front desk presente in ogni momento;Oggi ho avuto bisogno di informazioni sui trasporti e la reception ha risposto con precisione e cortesia. Il check-out è stato gestito in meno di cinque minuti. Servizio encomiabile.;Reception;positive
181;Colazzione fredda e prodotti scadenti;Il buffet della colazzione era allestito in modo trascurato: succhi industriali, brioche di ieri e nessun prodotto caldo degno di nota. Il ristorante aveva un odore chiuso e il personale F&B era assente.;F&B;negative
182; ECCEZIONALE!! #5stelle;#puliziastellare La pulizia camera era PERFETTA ogni giorno senza eccezioni!! Trovavo origami di asciugamani sul letto e scorte di cortesia SEMPRE rifornite!! @hotelstaff siete STRAORDINARI!! Tornerò solo per voi!!;Housekeeping;positive
183;Check-in completato senza intoppi;Arrivammo a tarda sera con un bambino piccolo e la reception ci sistemò in camera in meno di quattro minuti. Personale premuroso che capì subito la situazione. Ottima prima impressione.;Reception;positive
184;Ristorante privo di personalità;Per tre sere consecutive il ristorante proponeva piatti anonimi e poco curati. La colazione era nella media ma senza alcun prodotto locale o artigianale. Il personale F&B era gentile ma la qualità del cibo restava bassa.;F&B;negative
185;Pulizia zeroo!! #vamera sporca come schifo!!;Ma stiamo scherzando??!!! Trovai macchie sul copriletto e il WC non sanificato dal giorno prima!! HO CHIAMATO quattro volte la ricetionist!! NESSUNO è venuto!! VERGOGNA!!$$ @gestionehotel siete una VERGOGNA;Housekeeping;negative
186;Colazione eccellente ma reception disorganizzata;Il ristorante a colazione era genuinamente ottimo: prodotti freschi e personale F&B sorridente ogni mattina. Purtroppo il check-in aveva creato confusione con la tipologia di camera prenotata.;Reception;negative
187;Reception impeccabile ma ristorante da evitare;La receptionist ci accolse con professionalità e il check-in filò liscio in pochi minuti. La cena al ristorante quella stessa sera fu però una delusione: cibo tiepido e colazione del giorno dopo appena sufficiente.;Reception;positive
188;Mangiare e ristorante ottimo ma pulizie lasciate al caso;La colazione al ristorante era ogni mattina una vera gioia: prodotti biologici locali e personale F&B premuroso. La pulizia camera però deludeva sistematicamente: bagno con aloni e pavimento appiccicoso.;F&B;positive
189;Cibo scadente ma le pulizie sono state da applausi;La colazzione era mediocre e il ristorante a cena non migliorava le cose: porzioni scarse e servvizio lento. La pulizia camera invece era meticolosa ogni giorno: lenzuola fresche e dettagli sempre curati.;F&B;negative
190;Lavoro della signora delle pulizie  finalmente apprezzabile;Lo scorso anno la pulizia camera di questo hotel era insufficiente. Quest'anno invece il reparto ha fatto un deciso passo avanti: camera riassettata ogni mattina con cura e attenzione ai dettagli.;Housekeeping;positive
191;RICETIONIST INCOMPETENTE E MALEDUCATA!!??;Qual'è il problema di trovare una prenotazione già pagata?? La ricetionist al check-in sembrava non sapere usare il computer!! Aspettai TRENTA MINUTI in piedi con i bagagli!! Servvizio INDECENTE!!$$ #receptionhorror;Reception;negative
192;Menu del ristorante vario e ben eseguito;Stamattina la colazione offriva una selezione straordinaria di prodotti freschi. La cena di ieri sera al ristorante aveva confermato lo stesso livello: piatti regionali curati e personale F&B competente.;F&B;positive
193;Le signore delle pulizie puntuali come un orologio;Durante le cinque notti di soggiorno la pulizia camera era garantita ogni mattina entro le dieci. Nessuna richiesta necessaria: il personale lavorava in modo autonomo e discreto.;Housekeeping;positive
194;Colazzione immangiabille *SCHIFOSA*!!;#colazzionehorror Stamattina la colazzione era composta da roba avanzata di ieri e caffè ANNACQUATO!! Il ristorante puzzava di chiuso e il personale F&B ignorava i clienti!! Prezzo esagerato!!$$ MAI PIÙ!!;F&B;negative
195;Receptionist preparata e reattiva;Arrivai con una modifica dell'ultima ora sulla prenotazione e la reception gestì la situazione con calma e professionalità. Nessun intoppo e camera assegnata correttamente in pochi minuti.;Reception;positive
196;Condizioni della camera sotto ogni standard;Durante il soggiorno di aprile scorso la pulizia cammera era discontinua: un giorno sì e uno no senza alcuna logica. Il bagno presentava sempre residui visibili e gli asciugamani non venivano cambiati.;Housekeeping;negative
197;Ristorante dell'hotel una bella scoperta;Non avevo aspettative particolari ma la colazione del primo mattino mi ha subito convinto. Il ristorante ha mantenuto lo stesso standard per tutta la settimana. Personale F&B sempre professionale.;F&B;positive
198;CHECK-OUT TARDATO DI UN'ORA INTERA!!;Il check-out di stamattina è stato un disastro totale: la ricetionist impiegò SESSANTA MINUTI per correggere un addebito errato sul conto!! Nessuno si è scusato!! INACCETTABILE!!$$ #checkoutfail;Reception;negative
199;Camera curata con attenzione ai dettagli;Ogni sera rientravo e trovavo la stanza perfettamente in ordine con piccoli tocchi che dimostravano cura: scorte di cortesia rifornite e asciugamani piegati con precisione. Personale housekeeping davvero attento.;Housekeeping;positive
200;Qualità costante per tutto il soggiorno;Sia a colazione che a cena il ristorante ha mantenuto un livello elevato senza mai deludere. Il personale F&B era competente e la qualità degli ingredienti si sentiva chiaramente in ogni piatto.;F&B;positive
201;Trattamento impeccabile dal reparto pulizie;Ogni mattina la camera era già riassettata prima delle nove. La pulizia camera era curata nei minimi dettagli: bagno profumato, lenzuola tese e asciugamani freschi senza mai doverlo richiedere.;Housekeeping;positive
202;SISTEMA RECEPTION IN TILT TOTALE!!$$;Il check-in di ieri sera è durato QUARANTA MINUTI perché il gestionale della ricezzione era in panne. La ricetionist non sapeva cosa fare e nessun responsabile si è presentato!! #frontdeskzero VERGOGNA!!;Reception;negative
203;Colazione che vale il soggiorno da sola;Stamattina il buffet del ristorante era semplicemente magnifico: frutta tagliata al momento, formaggi locali e uova preparate su richiesta. Il personale F&B era premuroso e sempre presente.;F&B;positive
