id;title;body;department;sentiment
396;Pulizia cammera discontinua e frettolosa;Durante il soggiorno di novembre scorso la pulizia cammera veniva effettuata ogni tre giornni in modo superficiale. Il bagno presentava sempre residui visibili e gli asciugamani non venivano cambiati puntualmente.;Housekeeping;negative
397;Ristorante affidabile dall'inizio alla fine;Ogni pasto al ristorante ha confermato lo stesso standard elevato: colazione ricca con prodotti di stagione e cena curata con piatti regionali ben eseguiti. Il personale F&B era sempre disponibile e cordiale.;F&B;positive
398;CHECK-IN DURATO QUASI UN'ORA!!$$;Il check-in di ieri sera ha richiesto CINQUANTACINQUE MINUTI perché la ricetionist aveva sbagliato la categoria di camera!! Nessun responsabile si è presentato a risolvere!! INACCETTABILE per un hotel di questa categoria!!;Reception;negative
399;Cura autentica al dettaglio;Ogni sera rientravo e trovavo la stanza perfettamente riassettata con piccoli tocchi che dimostravano attenzione genuina: scorte rifornite, cuscini sistemati con cura e bagno sempre impeccabile.;Housekeeping;positive
400;Esperienza gastronomica sopra ogni aspettativa;La colazione offriva ogni mattina prodotti freschi e locali in abbondanza. Il ristorante a cena confermava lo stesso livello con piatti curati e un personale F&B attento e professionale per tutto il soggiorno.;F&B;positive
401;Rifacimento letti approssimativo;Il personale ha soltanto tirato su la coperta senza sistemare le lenzuola sottostanti, un servizio davvero superficiale per tutta la durata del soggiorno;Housekeeping;negative
402;RICETIONIST IMPREPARATA AL CHECK-IN!!$$;Arrivammo puntuali e trovammo la ricetionist incapace di trovare la prenotazione nel sistema!! Il check-in durò CINQUANTACINQUE MINUTI mentre noi aspettavamo con i bagagli in piedi!! VERGOGNOSO!! #frontdeskzero @hotelmanagement;Reception;negative
403;Sapori regionali autentici ogni mattina;Il buffet della colazione offriva ogni giorno prodotti freschi e locali: formaggi artigianali, frutta di stagione e dolci fatti in casa. Il personale F&B era discreto e sempre presente al momento giusto.;F&B;positive
404;Tre giornni senza pulizia della vamera;Richiedemmo l'intervento due volte senza risultato. La pulizia cammera era chiaramente non prioritaria: il bagno veniva pulito solo in superficie e il pavimento non veniva lavato correttamente.;Housekeeping;negative
405;Personale reception disponibile e preciso;Oggi ho avuto un disguido con la fatturazione e il receptionist ha risolto tutto in meno di cinque minuti con competenza e cortesia. Check-out gestito in modo esemplare senza alcun intoppo.;Reception;positive
406;Collazzione indegna e perssonalle assente;Il buffet della collazzione offriva prodotti di bassa quualità disposti male. Il ristoarnte era rumoroso e il perssonalle F&B sembrava completamente indifferente agli ospiti. Per il prezzo pagato è inaccettabile.;F&B;negative
407;CAMERA PULITISSIMA OGNI GIORNO!! #tophotel;#housekeepingperfetto Non avevo mai trovato tanta cura!! La pulizia camera era STRAORDINARIA: pavimento BRILLANTE, asciugamani piegati a ventaglio e cioccolatino sul letto!! @hotelstaff SIETE FANTASTICI!! Torneremo!!;Housekeeping;positive
408;Primo impatto eccellente alla reception;Arrivammo con due bambini stanchi dopo un lungo viaggio e la reception ci sistemò in camera in meno di quattro minuti. Il personale era premuroso e professionale nonostante l'affollamento.;Reception;positive
409;Ristorante deludente dall'inizio alla fine;Per sei sere il ristorante proponeva gli stessi piatti anonimi e mal curati. La colazione variava appena di giorno in giorno. Il personale F&B era educato ma la quualità del cibo restava invariabilmente bassa.;F&B;negative
410;Cammera sporca!! #vamera vergognosa @hotel$$;Ma stiamo scherzando??!!! Trovai capelli nella doccia e macchie SUL CUSCINO dal giorno prima!! Chiamai QUATTRO VOLTE la ricetionist e NESSUNO arrivò!! HO FOTOGRAFATO TUTTO!! INACCETTABBILE per questi prezzi!!;Housekeeping;negative
411;Reception disorganizzata tantissimo ma si mangia bene;Il check-in aveva creato confusione con la tipologia di camera e il perssonalle alla reception sembrava disorientato per tutta la procedura e non sapeva che fare ma fortunatamente il ristorante compensava ampiamente con delle prelibatezze straordinaria ogni mattina.;Reception;negative
412;Check-in impeccabile ma ristorante da evitare;La receptionist completò il check-in in tre minuti esatti con cortesia e professionnalità. La cena al ristorante quella sera fu però mediocre: cibo tiepido e colazione del giorno dopo appena sufficiente.;Reception;positive
413;Colazione da cinque stelle ma housekeeping carente;Il ristorante a colazione era di altissimo livello: prodotti biologici, caffè aromatico e personale F&B sorridente. La pulizia camera invece deludeva sistematicamente: bagno con aloni e pavimento appiccicoso per giorni.;F&B;positive
414;Cibo scadente ma pulizie impeccabili;La collazzione era mediocre e il ristoarnte a cena non convinceva affatto: porzioni ridotte e servvizio lentissimo. La pulizia camera però compensava: meticolosa ogni giorno con lenzuola fresche e bagno sanificato.;F&B;negative
415;Ah finalmente è tutto tornato ai livelli di eccellenza;L'anno scorso la pulizia camera di questo hotel aveva deluso. Quest'anno invece il reparto ha sorpreso positivamente: ogni angolo curato, bagno profumato e scorte rifornite puntualmente senza alcuna richiesta.;Housekeeping;positive
416;RICETIONIST SPARITA!! ADDEBITI ERRATI OVUNQUE!!??;Qual'è il senso di un front desk aperto se la ricetionist è irreperibile al check-out?? Mi presentò una fattura CON CINQUE ADDEBITI ERRATI e rispose male quando lo segnalai!! Servvizio INDECENTE!!$$ #checkoutfail;Reception;negative
417;Una cena davvero speciale;Non avevo pianificato di cenare in hotel ma il menù della sera mi ha convinto immediatamente. Il ristorante ha proposto piatti regionali raffinati, deliziosi e il perssonalle era preparato e discreto. Tornerò sicuramente.;F&B;positive
418;Ogni mattina la camera era perfetta;Durante le sei notti di soggiorno la pulizia camera fu garantita ogni mattina entro orario. Il personale housekeeping lavorava silenziosamente senza mai disturbare. Nessuna singola lamentela possibile.;Housekeeping;positive
419;Collazzione immangiabille!! *ROBA AVANZATA DI IERI*;#colazzionehorror Stamattina la collazzione comprendeva succhi scaduti e brioche DURE COME SASSI!! Il ristoarnte aveva ancora le sedie sui tavoli alle nove!! Perssonalle F&B COMPLETAMENTE ASSENTE!!$$ MAI PIÙ!!;F&B;negative
420;Accogglienzza calorosa e professionnalità alta;Arrivai con una modifica dell'ultima ora e la receptionist gestì la situazione con calma e competenza. Check-in completato in meno di tre minuti. Professionnalità che raramente si incontra in questo settore.;Reception;positive
421;Pulizia cammera discontinua per tutto il soggiorno;Durante il soggiorno di dicembre scorso la pulizia cammera veniva effettuata ogni tre giornni in modo frettoloso. Il bagno presentava sempre residui visibili e gli asciugamani non venivano mai cambiati puntualmente.;Housekeeping;negative
422;Ristorante sempre all'altezza delle aspettative;Ogni pasto al ristorante ha confermato lo stesso standard elevato: colazione ricca con prodotti di stagione e cena curata con piatti regionali ben presentati. Il perssonalle F&B era sempre disponibile e cordiale.;F&B;positive
423;CHECK-IN DURATO UN'ORA INTERA!!$$;Il check-in di ieri sera ha richiesto SESSANTA MINUTI perché la ricetionist aveva sbagliato la tipologia di camera prenotata!! Nessun responsabile si è presentato a risolvere la situazione!! INACCETTABILE per questi prezzi!!;Reception;negative
424;Cura per i dettagli che non dimenticherò;Ogni sera rientravo e trovavo la stanza perfettamente riassettata con piccoli tocchi che dimostravano attenzione genuina: scorte rifornite, cuscini sistemati con precisione e bagno sempre impeccabile senza mai chiedere.;Housekeeping;positive
425;Livello gastronomico superiore alla media;La colazione offriva ogni mattina prodotti freschi e locali in abbondanza. Il ristorante a cena confermava lo stesso livello con piatti curati e un perssonalle F&B attento e professionale fino all'ultimo giorno.;F&B;positive
426;Pulizia impeccabile per tutta la settimana;Per sette notti la pulizia camera era garantita ogni matttina entro le nove senza mai doverlo richiedere. Il reparto housekeeping lavorava in modo silenzioso e scrupoloso: bagno sanificato e asciugamani freschi ogni giorno.;Housekeeping;positive
427;CHECKOUT BLOCCATO !!$$;Arrivai alla reception stamattina e trovai la ricetionist incapace di stampare la fattura corretta!! Il check-out durò SESSANTA MINUTI per un errore nel sistema!! NESSUNO si scusò con me!! #checkoutfail @direzionehotel;Reception;negative
428;Colazione genuina e ben curata;Ogni matttina il buffet del ristorante sorprendeva con prodotti freschi e locali: formaggi artigianali, frutta tagliata al momento e dolci fatti in casa. Il perssonalle F&B era discreto e sempre presente.;F&B;positive
429;Vamera non pulita per tre giornni interi;Richiedemmo l'intervento dell'housekeeping due volte senza alcun risultato. La pulizia cammera era chiaramente non prioritaria: il bagno veniva pulito solo in superficie e il pavimento mai lavato correttamente.;Housekeeping;negative
430;Receptionist che risolve ogni problema;Oggi ho avuto un disguido con la prenotazione della sala colazioni e il personale della reception ha sistemato tutto in meno di tre minuti con competenza e il sorriso. Servizio di alto livello.;Reception;positive
431;Collazzione fredda e ristoarnte trascurato;Il buffet della collazzione offriva prodotti confezionati di bassa quualità. Il ristoarnte era sporco e il perssonalle F&B sembrava indifferente agli ospiti. Per il prezzo pagato è semplicemente inaccettabile.;F&B;negative
432;HOUSEKEEPING PERFETTO OGNI GIORNO!! #tophotel;#stellecinque Non avevo mai trovato tanta cura in un hootell!! La pulizia camera era STRAORDINARIA ogni singolo giorno: pavimento BRILLANTE e cioccolatino sul letto ogni ssera!! @hotelstaff GRAZIE!!;Housekeeping;positive
433;Accoglienza calorosa fin dal primo momento;Arrivammo con tre valigie pesanti dopo un lungo volo e la reception ci sistemò in camera in meno di quattro minuti. Il personale era premuroso e professionale nonostante la coda.;Reception;positive
434;Menu ristorante monotono e senza qualità;Per cinque ssere consecutive il ristorante proponeva gli stessi piatti anonimi e mal curati. La colazione variava appena. Il perssonalle F&B era educato ma la quualità del cibo restava invariabilmente bassa.;F&B;negative
435;Cammera SCHIFOSA!! #puliziazero @hootell$$;Ma stiamo scherzando??!!! Trovai capelli nella doccia e macchie SUL CUSCINO!! Chiamai TRE VOLTE la ricetionist e NESSUNO arrivò!! HO FOTOGRAFATO TUTTO e mandato mail!! INACCETTABBILE per questi prezzi!!;Housekeeping;negative
436;reparto pulizie ottimo ma reception disorganizzata;La pulizia camera era eccellente ogni matttina: dettagli curati e bagno sanificato puntualmente. Purtroppo il check-in aveva richiesto quaranta minuti per un disguido con la tipologia di camera prenotata.;Reception;negative
437;Reception velocissima ma molto deluso dal ristorante;La receptionist completò il check-in in tre minuti esatti con professionnalità e cortesia. La cena al ristorante quella ssera fu però mediocre: cibo tiepido e collazzione del giorno dopo appena sufficiente.;Reception;positive
438;Colazione eccellente ma pulizia camera trascurata;Il ristorante a colazione era ogni matttina di altissimo livello: prodotti biologici freschi e perssonalle F&B sorridente. La pulizia camera invece deludeva: bagno con aloni evidenti e pavimento appiccicoso per giornni.;F&B;positive
439;Servizio camere eccellente, ma la ristorazione è da rivedere;La collazzione era scadente e il ristoarnte a cena non convinceva: menu limitato e servvizio lentissimo. La pulizia camera però era meticolosa ogni giorno: lenzuola fresche e bagno sempre sanificato.;F&B;negative
440;Standard housekeeping superiore alle attese;Non mi aspettavo tanta cura da un hootell di questa fascia. La pulizia camera era invece impeccabile ogni matttina: ogni angolo curato, bagno profumato e scorte di cortesia sempre rifornite puntualmente.;Housekeeping;positive
441;RICETIONIST MALEDUCATA!! FATTURA PIENA DI ERRORI!!??;Qual'è il senso di avere un gestionale se la ricetionist non sa usarlo?? Al check-out mi presentò una fattura CON TRE ERRORI GRAVI e rispose male quando lo segnalai!! Servvizio INDECENTE!!$$ #checkoutfail;Reception;negative
442;Pranzo al ristorante una vera sorpresa;Non avevo pianificato di mangiare in hootell ma il menù del pommeriggio mi ha convinto subito. Il ristorante ha proposto piatti regionali raffinati e un perssonalle F&B preparato e cordiale. Tornerò sicuramente.;F&B;positive
443;Reparto pulizie silenzioso e puntuale;Le sei notti di soggiorno sono trascorse senza un solo problema legato alla pulizia camera. Il personale housekeeping lavorava ogni matttina con discrezione lasciando tutto in perfetto ordine senza mai disturbare.;Housekeeping;positive
444;Collazzione immangiabille!! *ROBA SCADUTA*!!;#colazzionehorror Stamattina la collazzione comprendeva succhi con data scaduta e croissant DURI COME IL CEMENTO!! Il ristoarnte aveva le sedie ancora sui tavoli alle nove!! Perssonalle F&B ASSENTE!!$$ MAI PIÙ!!;F&B;negative
445;Accogglienzza professionnale dalla prima parola;Arrivai esausto dopo un volo cancellato e riprogrammato e la receptionist mi accolse con calma e competenza. Check-in completato in meno di tre minuti nonostante la situazione complicata.;Reception;positive
446;Pulizia cammera discontinua e inaffidabile;Durante il soggiorno di gennaio scorso la pulizia cammera veniva effettuata ogni tre giornni in modo frettoloso. Il bagno presentava sempre residui visibili e gli asciugamani non venivano cambiati nonostante le richieste.;Housekeeping;negative
447;Ristorante che conferma ogni giorno la qualità;Dalla ricca colazione a base di prodotti freschi di stagione fino alla cena, dove i piatti della tradizione regionale sono eseguiti magistralmente, la qualità della ristorazione non cala mai. Il team del reparto F&B corona l'esperienza con un servizio sempre attento, sorridente e pronto a ogni richiesta..;F&B;positive
448;CHECK-IN DURATO QUASI UN'ORA INTERA!!;Il check-in di ieri ssera ha richiesto CINQUANTA MINUTI perché la ricetionist aveva sbagliato la categoria di camera!! Nessun responsabile si è presentato!! INACCETTABILE per un hootell di questa categoria!!$$;Reception;negative
449;Lavoro che non dimenticherò;Ogni ssera rientravo e trovavo la stanza perfettamente riassettata con piccoli tocchi che dimostravano cura autentica: scorte rifornite, cuscini sistemati con precisione e bagno impeccabile senza mai doverlo richiedere.;Housekeeping;positive
450;Gastronomia di altissimo livello per tutto il soggiorno;La giornata iniziava al meglio con una colazione ricca di specialità locali e freschissime. Lo stesso standard elevato si ritrovava a cena, grazie a piatti preparati con cura e a un team F&B che si è dimostrato attento e professionale dal primo all'ultimo giorno..;F&B;positive
451;Otto notti di pulizia senza una mancanza;Per tutta la durata del soggiorno la pulizia camera era garantita ogni matttina entro le nove. Il reparto housekeeping lavorava in modo silenzioso e scrupoloso: bagno sanificato, lenzuola fresche e scorte sempre rifornite.;Housekeeping;positive
452;SISTEMA RECEPTION IN CONFUSIONE!!!??;Arrivammo stanchi dopo ore di viaggio e trovammo la ricetionist incapace di completare il check-in per un crash del gestionale!! SESSANTACINQUE MINUTI in piedi con i bagagli!! NESSUNO si scusò!! #frontdeskfail @hotelmanagement;Reception;negative
453;Colazione che ripaga da sola il prezzo;Ogni matttina il buffet del ristorante offriva una selezione straordinaria: formaggi artigianali, frutta fresca tagliata al momento e dolci fatti in casa. Il perssonalle F&B era premuroso e sempre sorridente.;F&B;positive
454;Vamera non toccata per quattro giornni;Richiedemmo l'intervento dell'housekeeping tre volte senza alcun risultato concreto. La pulizia cammera era chiaramente non prioritaria: il bagno veniva pulito solo in superficie e il pavimento non veniva lavato.;Housekeeping;negative
455;Receptionist precisa e orientata al cliente;Oggi ho chiesto alla reception di organizzare un trasferimento per l'aeroporto e il personale si è occupato di tutto in pochi minuti con competenza e cortesia. Check-out gestito in modo esemplare.;Reception;positive
456;Collazzione scadente e ristoarnte trascurato;Il buffet della collazzione offriva prodotti confezionati di bassa quualità disposti in modo sciatto. Il ristoarnte era rumoroso e il perssonalle F&B sembrava completamente indifferente agli ospiti presenti.;F&B;negative
457;PULIZIA CAMERA LEGGENDARIA!! #hootellTop;#housekeepingstellare Non avevo mai trovato tanta cura in un hootell!! La pulizia camera era PERFETTA ogni singolo giorno: pavimento LUCENTISSIMO e asciugamani piegati a cigno ogni ssera!! @hotelstaff GRAZIE MILLE!!;Housekeeping;positive
458;Weekend cominciato nel migliore dei modi;Arrivammo sabato ssera con due bambini piccoli e la reception ci sistemò in camera in meno di quattro minuti. Il personale era premuroso e professionale nonostante l'affollamento del fine settimana.;Reception;positive
459;Ristorante privo di qualità e ispirazione;Per cinque ssere consecutive il ristorante proponeva gli stessi piatti anonimi e mal curati. La colazione variava appena di giorno in giorno. Il perssonalle F&B era educato ma la quualità del cibo stagnava.;F&B;negative
460;Cammera DISGUSTOSA!! #puliziazero @hootell$$;Ma stiamo scherzando??!!! Trovai capelli nella doccia e macchie SUL COPRILETTO dal giorno prima!! Chiamai CINQUE VOLTE la ricetionist e NESSUNO arrivò!! HO FOTOGRAFATO TUTTO!! INACCETTABBILE per questi prezzi!!;Housekeeping;negative
461;Reception lenta ma colazione eccellente;Il check-in aveva richiesto quaranta minuti per un disguido con la prenotazione e il perssonalle alla reception sembrava disorientato. Fortunatamente il ristorante compensava con una collazzione straordinaria ogni matttina.;Reception;negative
462;Check-out rapido ma cibo pessimo;La receptionist gestì il check-out stamattina in meno di tre minuti con professionnalità e cortesia. Purtroppo la collazzione quella matttina era scadente come del resto la cena della ssera prima.;Reception;positive
463;Buffet straordinario ma tutto il resto trascrurato, soprattutto le pulizie.;Il ristorante a colazione era di altissimo livello ogni matttina: prodotti biologici, caffè aromatico e perssonalle F&B sorridente. La pulizia camera invece deludeva sistematicamente: bagno con aloni e pavimento appiccicoso.;F&B;positive
464;Cibo mediocre ma pulizie impeccabili ogni giorno;La collazzione era scadente e il ristoarnte a cena non convinceva affatto: porzioni ridotte e servvizio lentissimo. La pulizia camera però era meticolosa ogni giorno: lenzuola fresche e bagno sanificato senza eccezioni.;F&B;negative
465;Pulizie sono migliorate rispetto agli anni precedenti;Sono abituato ad alloggiare in questo hotel, e le pulizie non sono mai state cosi perfette come quest'anno. Quindi devo dire e fare i complimenti a tutto lo staff. Tutto pulito e in ordine.;Housekeeping;positive
466;RICETIONIST INCOMPETENTE!! CONTO SBAGLIATO COMPLETAMENTE!!??;Qual'è il senso di un gestionale se la ricetionist non sa usarlo?? Al check-out mi presentò una fattura CON QUATTRO ADDEBITI ERRATI e rispose male quando lo segnalai!! Servvizio INDECENTE!!$$ #checkoutfail @direzione;Reception;negative
467;Menù serale del ristorante da consigliare a tutti;Non avevo pianificato di cenare in hootell ma il menù della ssera mi ha convinto subito. Il ristorante ha proposto piatti regionali raffinati e un perssonalle F&B preparato e discreto. Tornerò sicuramente.;F&B;positive
468;Tenda della doccia sporca;La tenda della doccia era visibilmente annerita nella parte inferiore, un dettaglio igienico che andrebbe monitorato. Muffa a quantità;Housekeeping;negative
469;Collazzione immangiabille!! *PRODOTTI DI DUE GIORNI FA*;#colazzionehorror Stamattina la collazzione comprendeva succhi scaduti e brioche DURE COME IL GRANITO!! Il ristoarnte aveva ancora le sedie sui tavoli alle otto e mezza!! Perssonalle F&B COMPLETAMENTE ASSENTE!!$$ MAI PIÙ!!;F&B;negative
470;Accogglienzza professionnale che lascia il segno;Arrivai con una prenotazione modificata all'ultimo momento e la receptionist gestì la situazione con calma e competenza straordinaria. Check-in completato in meno di tre minuti nonostante la complicazione.;Reception;positive
471;Pulizia cammera inesistente per giorni interi;Durante il soggiorno di febbraio scorso la pulizia cammera veniva effettuata ogni tre giornni in modo frettoloso. Il bagno presentava sempre residui visibili e gli asciugamani non venivano cambiati nonostante le richieste ripetute.;Housekeeping;negative
472;Ristorante che non delude mai a nessun pasto;L'offerta gastronomica ha mantenuto costantemente uno standard elevato, grazie a una colazione ricca di prodotti stagionali e a una cena incentrata su piatti regionali accuratamente eseguiti. Il personale F&B si è distinto per la costante disponibilità e la spiccata cordialità..;F&B;positive
473;CHECK-IN DURATO UN'ORA E MEZZA ASSURDA!!;Il check-in di ieri ssera ha richiesto NOVANTA MINUTI perché la ricetionist aveva sbagliato la categoria di camera prenotata e il sistema era in panne!! Nessun responsabile si è presentato!! INACCETTABILE!!$$;Reception;negative
474;Stato della stanza deludente;Al nostro arrivo abbiamo trovato i vetri delle finestre opachi e molta polvere sulla testata del letto.;Housekeeping;negative
475;Esperienza gastronomica superiore a ogni aspettativa;Ogni risveglio è stato accompagnato da un buffet mattutino ricco di autentiche primizie locali. Una costanza qualitativa che si rifletteva anche nella proposta serale, dove la ricercatezza delle pietanze si univa alla professionalità impeccabile e alla dedizione dello staff di sala.;F&B;positive
476;Nove notti senza una singola mancanza;Per tutta la durata del soggiorno la pulizia camera era garantita ogni matttina entro le nove senza mai doverlo richiedere. Il reparto housekeeping lavorava con discrezione e scrupolo: bagno sanificato e lenzuola fresche ogni giorno.;Housekeeping;positive
477;RAGAZZA SPARITA AL CHECK-IN!!$$;Arrivammo puntuali e trovammo il bancone VUOTO per venti minuti!! Quando finalmente apparve la ricetionist sembrava scocciata di dover lavorare!! Il check-in durò CINQUANTA MINUTI!! INACCETTABILE!!$$ #frontdeskzero @hotelmanagement;Reception;negative
478;Prodotti freschi e locali ogni matttina;Il buffet della colazione sorprendeva ogni giorno con una selezione generosa: formaggi artigianali, frutta di stagione tagliata al momento e dolci fatti in casa. Il perssonalle F&B era attento e sempre presente.;F&B;positive
479;Cammera non pulita per tre giornni di fila;Segnalai l'assenza della pulizia cammera due volte senza risultato concreto. Il bagno veniva pulito solo in superficie e il pavimento non veniva mai lavato correttamente. Situazione inaccettabile per il prezzo pagato.;Housekeeping;negative
480;Front desk sempre operativo e preciso;Oggi ho avuto un problema con il riscaldamento della camera e la reception ha inviato la manutenzione in meno di dieci minuti. Reattività e cortesia esemplari durante tutto il soggiorno.;Reception;positive
481;Collazzione indegna e perssonalle inesistente;Il buffet della collazzione offriva prodotti confezionati di bassa quualità. Il ristoarnte era sporco e il perssonalle F&B sembrava completamente indifferente agli ospiti presenti anche quando venivano chiamati direttamente.;F&B;negative
482;CAMERA PULITISSIMA OGNI SINGOLO GIORNO!! #leggenda;#housekeepingperfetto Non avevo mai trovato tanta cura in un hootell!! La pulizia camera era STRAORDINARIA: pavimento BRILLANTE, asciugamani piegati a cigno e cioccolatino sul letto ogni ssera!! @hotelstaff FANTASTICI!!;Housekeeping;positive
483;Ultima notte del viaggio iniziata bene;Arrivammo stanchi dopo una lunga settimana e la reception ci sistemò in camera in meno di quattro minuti. Il personale era premuroso e professionale nonostante l'ora tarda e la fila presente.;Reception;positive
484;Ristorante senza qualità né varietà;Per sei ssere consecutive il ristorante proponeva gli stessi piatti anonimi e privi di cura. La colazione variava appena di giorno in giorno. Il perssonalle F&B era educato ma la quualità del cibo stagnava invariabilmente.;F&B;negative
485;Cammera SCHIFOSA!! #vamera vergogna @hootell!!;Ma stiamo scherzando??!!! Trovai capelli sul cuscino e il WC non sanificato dal giorno prima!! Chiamai QUATTRO VOLTE la ricetionist e NESSUNO arrivò!! HO FOTOGRAFATO TUTTO e mandato mail!! INACCETTABBILE!!$$;Housekeeping;negative
486;Reception disorganizzata ma F&B eccellente;Il check-in aveva creato confusione con la categoria di camera e il perssonalle alla reception sembrava disorientato per tutta la procedura. Fortunatamente il ristorante compensava con una collazzione straordinaria ogni matttina.;Reception;negative
487;Check-in impeccabile ma ristorante da evitare;La receptionist completò il check-in in tre minuti esatti con professionnalità e cortesia. La cena al ristorante quella ssera fu però una delusione totale: cibo tiepido e collazzione del giorno dopo appena sufficiente.;Reception;positive
