id;title;body;department;sentiment
204;Sporcizzia evidente fin dall'ingresso;Arrivati in hotel, nelle aree comuni, c'era gia un odore strano e si avvertiva sporcizia nell'aria. Una volta arrivati in camera,aprimmo la porta  e notammo subito il pavimento appiccicoso e un odore sgradevole. La pulizia cammera era stata chiaramente saltata. Segnalai il problema ma l'intervento fu tardivo e frettoloso.;Housekeeping;negative
205;Personale alla reception davvero in gamba;Oggi ho avuto un disguido con la fatturazione e il receptionist ha risolto tutto in meno di cinque minuti con cortesia e competenza. Check-out gestito in modo esemplare.;Reception;positive
206;Ristoarnte senza qualità né cura  e Buffet spoglio e disorganizzato;La cena al ristoarnte fu una delusione su tutti i fronti: piatti freddi, ingredienti di bassa qualità e i camerieri assenti durante il servizio. La colazzione del mattino dopo non migliorò le cose,Siamo scesi alle nove ed era rimasto solo del pane raffermo, niente brioche o succhi. Nessuno rimpiazza il cibo consumato.;F&B;negative
207;PULIZIA CAMERA LEGGENDARIA!! #5stellehotel;#housekeepinggoals Non avevo mai visto tanta cura!! La pulizia camera era PERFETTA ogni giorno: pavimento BRILLANTE, origami di asciugamani sul letto e scorte SEMPRE rifornite!! @hotelmanagement GRAZIE DI CUORE!!;Housekeeping;positive
208;Una notte tranquilla grazie al personale efficiente della Reception;Arrivammo esausti dopo un lungo viaggio e il portire che ci accolse ci sistemò in camera immediatamente. Il personale era calmo e professionale nonostante si fosse fatto tardi. Prima impressione ottima.;Reception;positive
209;Menu del ristorante monotono e ripetitivo;Per cinque sere consecutive il ristorante proponeva gli stessi quattro piatti principali. La colazione variava appena di giorno in giorno. Il personale F&B era educato ma la qualità del cibo stagnava.;F&B;negative
210;Cammera una vergogna!! #puliziazero!!$$;Ma stiamo scherzando??!!! Trovai la cammera con macchie sul copriletto e il WC non sanificato!! Chiamai tre volte la ricetionist e NESSUNO si presentò!! HO FOTOGRAFATO TUTTO!! @direzionehotel INACCETTABBILE!!;Housekeeping;negative
211;Reception ottima ma che razza di cibo mi avete servito??;Il check-in fu gestito con rapidità e il personale della reception si dimostrò disponibile per tutto il soggiorno. Purtroppo il ristorante deludeva sia a colazione che a cena: cibo mediocre e servvizio lento, anzi lentissimo , Mi sono sentito anche male, cosa mi avete dato??;Reception;positive
212;Ristorante ottimo ma reception da rivedere;La colazione al ristorante era eccellente ogni mattina e il personale ci ha viziati con prodotti freschi e locali. Purtroppo il check-out aveva richiesto mezz'ora per un errore nell'addebito. Devo annotare ciò.;Reception;negative
213;Colazione straordinaria ma pulizia camera insufficiente;Il ristorante offriva ogni mattina una colazione di altissimo livello: prodotti biologici, caffè aromatico e personale F&B sorridente. La pulizia camera invece deludeva: bagno con residui visibili e pavimento non lavato.;F&B;positive
214;Cibo scadente ma le pulizie ok!!;La colazzione era appena sufficiente e il ristorante a cena non convinceva affatto: porzioni ridicole e piatti anonimi. La pulizia camera però compensava ampiamente: impeccabile ogni giorno senza eccezioni.;F&B;negative
215;Miglioramento netto del reparto pulizie;Due soggiorni fa la pulizia camera di questo hotel era nella media. Questa volta invece ho trovato un livello nettamente superiore: ogni dettaglio curato e bagno sanificato quotidianamente.;Housekeeping;positive
216;RICETIONIST SPARITA!! ATTESA ASSURDA!!??;Arrivai all'orario di check-in e trovai il bancone VUOTO per quindici minuti!! Quando finalmente apparve la ricetionist sembrava scocciata di dover lavorare!! Servvizio INDECENTE!!$$ #accogglienzzzapessima @hotel;Reception;negative
217;Antipasti del ristorante da standing ovation;Ieri sera la cena al ristorante ha superato ogni aspettativa: antipasti regionali raffinati, primo piatto eccellente e personale F&B preparato e discreto. La colazione stamattina era altrettanto curata.;F&B;positive
218;Tutto regolare e affidabile;Per tutte le quattro notti del soggiorno la pulizia camera fu garantita ogni mattina entro orario. Niente di straordinario ma tutto funzionava: bagno pulito e lenzuola cambiate puntualmente.;Housekeeping;positive
219;Colazzione immangiabille *ROBA DI IERI*!!;#colazzionehorror Stamattina la colazzione era composta da croissant duri e succhi annacquati!! Il ristoarnte aveva le sedie ancora capovolte sui tavoli alle otto!! Addetti e personale sono INESISTENTi!!$$ MAI PIÙ qui!!;F&B;negative
220;Receptionist formato e reattivo per problematiche;Arrivai con una richiesta speciale per una camera al piano alto lontana dall'ascensore. La reception soddisfò la richiesta immediatamente e senza fare domande. Accogglienzza professionale e discreta.;Reception;positive
221;Camera trascurata per tutto il soggiorno;Durante il soggiorno di maggio scorso la pulizia cammera veniva eseguita ogni due giorni in modo frettoloso. Trovavo sempre residui nel bagno e asciugamani non sostituiti nonostante le richieste.;Housekeeping;negative
222;Ristorante apprezzato da tutta la famiglia;Ogni pasto al ristorante è stato una conferma: la colazione abbondante e varia, la cena curata e il personale F&B attento anche con i bambini. Una delle migliori esperienze gastronomiche in hotel.;F&B;positive
223;CHECKKIN DURATO UN SECOLO!!;Il check-in di ieri ha richiesto 45 MINUTI per un banale problema di prenotazione. La ricetionist sembrava incapace di gestire la situazione e nessun responsabile è intervenuto!! INACCETTABILE!!$$;Reception;negative
224;Biancheria logora e puzzolente;Ci hanno lasciato degli asciugamani usurati e macchiati, un servizio che non ci aspettavamo da una struttura simile.;Housekeeping;negative
225;Standard ristorante mantenuto ecquamente;Sia a colazione che a cena il ristorante ha confermato lo stesso livello elevato senza mai deludere. Il personale F&B era competente e cordiale e la qualità degli ingredienti si sentiva chiaramente ad ogni pasto.;F&B;positive
226;Cinque notti senza un solo problema;La pulizia camera era garantita ogni mattina entro le nove senza mai doverlo richiedere. Il reparto housekeeping ha lavorato con costanza e discrezione per tutta la durata del soggiorno.;Housekeeping;positive
227;CHECK-IN CAOTICO E SENZA SCUSE!!$$;Arrivammo puntuali all'orario previsto e trovammo il bancone presidiato da una sola ricetionist per dodici persone in fila. Il check-in durò CINQUANTACINQUE MINUTI!! INACCETTABILE!!$$ #frontdeskfail @hotelmanagement;Reception;negative
228;Buffet mattutino di altissimo livello;Ogni mattina il ristorante sorprendeva con una selezione sempre varia: formaggi artigianali, uova preparate al momento e caffè eccellente. Il personale F&B anticipava ogni richiesta con discrezione.;F&B;positive
229;Residui ovunque nella vamera;Aprimmo la vamera e trovammo subito aloni sullo specchio del bagno e polvere sui comodini. La pulizia cammera era stata chiaramente fatta in fretta. Segnalai il problema ma l'intervento fu scarso.;Housekeeping;negative
230;Front desk reattivo e ben organizzato;Stamattina ho chiesto alla reception di anticipare il check-out e la risposta è stata immediata. Fattura corretta al primo colpo e bagagli custoditi senza problemi. Servizio encomiabile.;Reception;positive
231;Colazzione indegna di un hotel a quattro stelle;Il buffet della colazzione offriva prodotti scadenti e mal conservati. Il ristoarnte era rumoroso e il personale F&B sembrava non curarsi degli ospiti. Per il prezzo pagato mi aspettavo molto di più.;F&B;negative
232;PULIZIA CAMERA AL TOP ASSOLUTO!! #incredibile;#housekeepingperfetto Ogni singolo giorno la pulizia camera era STRAORDINARIA: pavimento LUCIDISSIMO, asciugamani piegati a ventaglio e cioccolatino sul cuscino!! @hotelstaff SIETE FANTASTICI!! Torneremo sicuramente!!;Housekeeping;positive
233;Nessun intoppo dall'arrivo alla partenza;Il check-in di domenica sera fu rapido e il personale della reception ci spiegò tutti i servizi con chiarezza. Il check-out stamattina è stato altrettanto fluido. Esperienza senza sbavature.;Reception;positive
234;Ristorante deludente a ogni pasto;Per quattro giorni consecutivi la cena al ristorante fu mediocre: piatti tiepidi, menu ripetitivo e personale F&B distratto. La colazione non andava meglio: prodotti confezionati e caffè annacquato.;F&B;negative
235;Cammera schifosa!! #puliziazero vergogna!!;Ma che schifo trovammo in quella cammera!!?? Capelli nella doccia, macchie sul copriletto e cestino mai svuotato!! HO FOTOGRAFATO TUTTO!! La ricetionist si scusò ma NON cambiò niente!! INACCETTABBILE!!$$;Housekeeping;negative
236;Reparto pulizie ottimo ma reception lenta;La pulizia camera era eccellente ogni giorno: bagno sanificato, lenzuola fresche e dettagli curati. Purtroppo il check-in aveva richiesto quaranta minuti per un problema con la prenotazione online.;Reception;negative
237;Reception velocissima ma ristorante assolutamente no, da rivedere !!;Il check-in filò liscio in tre minuti grazie a una receptionist preparata e cordiale. La cena al ristorante quella sera fu però deludente e la colazione del mattino dopo era appena tollerabile.;Reception;positive
238;Ristorante da premiare ma deludente servizio pulizie;La colazione al ristorante era una vera gioia ogni mattina: prodotti freschi, varietà ampia e personale F&B sorridente. La pulizia camera invece deludeva: trovavamo spesso il bagno con aloni e il pavimento non lavato.;F&B;positive
239;Promosso il personale delle pulizie, bocciato il ristorante;La colazzione era scadente e il ristorante a cena non convinceva: menu limitato e servvizio lentissimo. La pulizia camera però era meticolosa ogni giorno: lenzuola cambiate e bagno sempre sanificato.;F&B;negative
240;Qualità housekeeping superiore alle aspettative;Non mi aspettavo tanta cura da un hotel di questa fascia di prezzo. La pulizia camera era invece impeccabile: ogni angolo curato e scorte di cortesia sempre rifornite puntualmente.;Housekeeping;positive
241;RICETIONIST SPARITA AL CHECK-OUT!!??;Qual'è il senso di un front desk aperto se la ricetionist è IRREPERIBILE per venti minuti?? Aspettai con i bagagli in mano mentre il taxi attendeva fuori!! Servvizio INDECENTE!!$$ #checkoutfail @direzione;Reception;negative
242;Pranzo al ristorante una vera rivelazione;Non avevo pianificato di pranzare in hotel ma il menu del giorno mi ha convinto. Il ristorante ha espresso il meglio con piatti regionali ben eseguiti e personale F&B preparato. Tornerò sicuramente.;F&B;positive
243;Odore sgradevole e pesantissimo;La camera aveva un forte odore di fumo stagnante. Abbiamo chiesto un cambio di stanza alla reception ma l'hotel era completo.;Housekeeping;negative
244;Colazzione immangiabille!! *ROBA SCADUTA*!!;#scandaloso Stamattina la colazzione comprendeva succhi con la data scaduta e croissant DURI come pietra!! Il ristoarnte puzzava di umido e il personale F&B era INESISTENTE!! Prezzo esagerato!!$$ MAI PIÙ!!;F&B;negative
245;Accogglienzza calorosa alla reception;Arrivai stanca dopo un lungo viaggio e la receptionist mi accolse con un sorriso genuino. Il check-in fu completato in pochi minuti e mi fornì consigli utili sui ristoranti della zona.Sono rimasto colpito per tanta disponibilità.;Reception;positive
246;Camera lasciata a se stessa per giorni;Durante il soggiorno di giugno scorso la pulizia cammera veniva effettuata ogni tre giorni in modo frettoloso. Il bagno presentava residui visibili e gli asciugamani non venivano cambiati nonostante le richieste ripetute.;Housekeeping;negative
247;Ristorante dell'hotel da consigliare;Sia la colazione che la cena al ristorante hanno mantenuto uno standard elevato per tutto il soggiorno. Il personale F&B era formato e attento e la qualità degli ingredienti si sentiva ad ogni piatto.;F&B;positive
248;CHECK-IN DISASTROSO!! UN'ORA PERSA!!;Il check-in di ieri sera ha richiesto SESSANTA MINUTI perché la ricetionist aveva sbagliato la tipologia di camera prenotata!! Nessun responsabile si è presentato a scusarsi!! INACCETTABILE per questi prezzi!!$$;Reception;negative
249;Dettagli trascurati;Il soggiorno di quattro notti è stato deludente perché c'erano ragnatele vicino al lampadario e i comodini non erano stati spolverati.;Housekeeping;negative
250;Esperienza gastronomica sopra la media;La colazione offriva ogni mattina una selezione generosa di prodotti freschi e locali. Il ristorante a cena confermava lo stesso livello con piatti curati e personale F&B sempre disponibile. Ottima gestione complessiva.;F&B;positive
251;Quattro notti senza un solo disguido;La pulizia camera era puntuale e accurata ogni mattina. Il reparto housekeeping lavorava in modo discreto e professionale: bagno sanificato, lenzuola tese e asciugamani sempre freschi.;Housekeeping;positive
252;ATTESA VERGOGNOSA AL BANCONE!!$$;Due ricetionist in pausa contemporaneamente con dieci ospiti in fila!! Il check-in durò QUARANTACINQUE MINUTI per un errore di sistema mai risolto!! SCANDALOSO!! #receptionzero @gestionehotel;Reception;negative
253;Sapori del territorio al ristorante;Ieri sera la cena al ristorante ha proposto piatti della tradizione locale con ingredienti freschi e ben lavorati. Il personale F&B era attento e discreto. La colazione stamattina ha confermato lo stesso livello.;F&B;positive
254;Vamera non toccata per due giorni interi;Trovammo il pavimento appiccicoso e il WC non sanificato al secondo giorno. La pulizia cammera era evidentemente saltata. Richiedemmo intervento tre volte prima che qualcuno si presentasse.;Housekeeping;negative
255;Receptionist puntuale e sorridente;Oggi il check-out è stato gestito in meno di quattro minuti: fattura corretta, bagagli custoditi e taxi chiamato spontaneamente. Piccoli gesti che fanno la differenza in un soggiorno.;Reception;positive
256;Ristoarnte sotto ogni standard possibile;La cena al ristoarnte era fredda e insipida. La colazzione del mattino dopo non migliorò: succhi artificiali, brioche confezionate e caffè tiepido. Personale F&B svogliato e poco presente.;F&B;negative
257;HOUSEKEEPING STRAORDINARIO!! #stellecinque;#puliziatop Ogni giorno la pulizia camera era PERFETTA senza eccezioni!! Trovavo origami di asciugamani e scorte SEMPRE rifornite!! @hotelstaff siete INCREDIBILI!! La migliore esperienza housekeeping mai avuta!!;Housekeeping;positive
258;Soggiorno iniziato nel migliore dei modi;Arrivammo con mezz'ora di anticipo e la reception riuscì comunque ad assegnarci la camera immediatamente. Professionalità e flessibilità che raramente si trovano. Check-in completato in tre minuti.;Reception;positive
259;Colazione nella media senza guizzi;Per tutta la durata del soggiorno il ristorante a colazione offriva sempre gli stessi prodotti anonimi. La varietà era minima e niente sembrava fatto in casa. Il personale F&B era gentile ma il cibo restava mediocre.;F&B;negative
260;Cammera sporca!! #schifoso @hotelmanagement!!;Ma stiamo scherzando??!!! Trovai capelli nella doccia e macchie SUL CUSCINO!! Chiamai quattro volte la ricetionist e NESSUNO venne!! HO LASCIATO RECENSIONE OVUNQUE!! Prezzo esagerato!!$$ VERGOGNA TOTALE!!;Housekeeping;negative
261;Ristorante eccellente ma reception disorganizzata;La colazione al ristorante era genuinamente ottima ogni mattina: prodotti locali freschi e personale F&B premuroso. Il check-in però aveva creato confusione con la tipologia di camera prenotata.;Reception;negative
262;Check-in perfetto ma ristorante deludente;La receptionist ci accolse con professionalità e il check-in filò liscio in pochi minuti. La cena al ristorante quella stessa sera fu mediocre e la colazione del giorno dopo era appena sufficiente.;Reception;positive
263;Colazione da cinque stelle ma pulizie zero;Il ristorante a colazione era straordinario: prodotti biologici, caffè aromatico e personale F&B sorridente. La pulizia camera invece era carente: bagno con aloni evidenti e pavimento non lavato per giorni.;F&B;positive
264;Cibo mediocre ma pulizie eccellenti;La colazzione era scadente e il ristorante a cena non convinceva: porzioni scarse e servvizio lentissimo. La pulizia camera però era impeccabile ogni giorno: lenzuola fresche e dettagli curati.;F&B;negative
265;Reparto pulizie finalmente all'altezza;L'anno scorso la pulizia camera di questo hotel era insufficiente. Quest'anno invece ho trovato un livello nettamente superiore: ogni angolo curato e bagno sanificato quotidianamente senza richieste.;Housekeeping;positive
266;RICETIONIST INCOMPETENTE!! ADDEBITI SBAGLIATI!!??;Qual'è il senso di avere un gestionale se la ricetionist non sa usarlo?? Al check-out mi presentò un conto CON TRE ADDEBITI ERRATI!! Aspettai un'ora per la correzione!! Servvizio INDECENTE!!$$ #checkoutfail;Reception;negative
267;Cena al ristorante da ricordare a lungo;Non avevo pianificato di cenare in hotel ma il menu della sera mi ha convinto al volo. Il ristorante ha sorpreso con piatti curati e un personale F&B che anticipava ogni necessità. Esperienza memorabile.;F&B;positive
268;Servizio veramente carente;Siamo rimasti tre giorni nella struttura senza che venisse mai svuotato il cestino dei rifiuti della camera.;Housekeeping;negative
269;Colazzione immangiabille *PRODOTTI SCADUTI*!!;#colazzionehorror Stamattina trovai succhi con data scaduta e croissant DURI COME SASSI!! Il ristoarnte aveva le sedie ancora sui tavoli alle otto e mezza!! Personale F&B ASSENTE!!$$ MAI PIÙ qui!!;F&B;negative
270;Accogglienzza calorosa e professionale;Arrivai tardi con un bambino piccolo e la receptionist ci sistemò immediatamente con grande gentilezza. Il check-in fu brevissimo e ci fornì tutte le informazioni necessarie senza che le chiedessimo.;Reception;positive
271;Pulizia cammera discontinua e inaffidabile;Durante il soggiorno di agosto scorso la pulizia cammera veniva effettuata a giorni alterni senza alcuna logica. Il bagno presentava sempre residui visibili e gli asciugamani non venivano cambiati puntualmente.;Housekeeping;negative
272;Ristorante affidabile e ben gestito;Ogni pasto al ristorante ha confermato lo stesso standard: colazione ricca e varia, cena curata con prodotti di qualità e personale F&B sempre disponibile. Una delle migliori esperienze gastronomiche in hotel.;F&B;positive
273;CHECK-OUT DURATO UN'ETERNITÀ!!;Il check-out di stamattina è stato un disastro: la ricetionist impiegò 50 MINUTI per correggere un addebito errato!! Nessun responsabile si è presentato a scusarsi!! INACCETTABILE per questi prezzi!!$$;Reception;negative
274;Cura e attenzione dagli addetti delle pulizie.;Ogni sera rientravo e trovavo la stanza perfettamente riassettata con piccoli tocchi che dimostravano attenzione: scorte rifornite, cuscini sistemati con precisione e bagno sempre profumato.;Housekeeping;positive
275;Esperienza gastronomica che vale il viaggio;La colazione offriva ogni mattina prodotti freschi e locali in abbondanza. Il ristorante a cena confermava lo stesso livello con piatti regionali curati e personale F&B competente e cordiale.;F&B;positive
276;Sei notti di pulizia impeccabile;Rientravo in camera ogni pomeriggio trovando tutto perfettamente riordinato. La pulizia camera era meticolosa: bagno profumato, lenzuola tese e asciugamani freschi senza mai doverlo richiedere.;Housekeeping;positive
277;TUTTO BLOCCATO AL CHECK-IN!!$$;Arrivammo puntuali e trovammo la ricetionist che fissava lo schermo incapace di procedere. Il check-in durò CINQUANTACINQUE MINUTI per un crash del gestionale!! NESSUNO si scusò!! #frontdeskzero @direzionehotel;Reception;negative
278;Colazione che supera ogni aspettativa;Ogni mattina il buffet del ristorante offriva una selezione straordinaria: formaggi locali, frutta fresca tagliata al momento e uova preparate su richiesta. Il personale F&B era premuroso e sempre presente.;F&B;positive
279;Pavimento appiccicoso e bagno non sanificato;Entrammo nella vamera e notammo subito un odore sgradevole e il pavimento mai lavato. La pulizia cammera era stata chiaramente saltata. Segnalai il problema due volte prima che qualcuno intervenisse.;Housekeeping;negative
280;Receptionist intuitiva e premurosa;Oggi ho chiesto informazioni su come raggiungere il centro storico e la receptionist ha preparato un piccolo itinerario scritto a mano. Check-in era già stato rapido la sera prima. Servizio davvero sopra la media.;Reception;positive
281;Ristoarnte privo di qualità e cura;La cena al ristoarnte fu deludente su tutti i fronti: piatti freddi, ingredienti anonimi e personale F&B distratto. La colazzione del mattino dopo non migliorò: prodotti confezionati e caffè insipido.;F&B;negative
282;PULIZIA CAMERA LEGGENDARIA!! #tophotel;#housekeepingstellare Non avevo mai trovato tanta cura in un hotel!! La pulizia camera era PERFETTA ogni giorno: pavimento BRILLANTE, asciugamani piegati a cigno e scorte SEMPRE rifornite!! @hotelstaff GRAZIE!!;Housekeeping;positive
283;Tutto filato liscio dall'arrivo alla partenza;Il check-in di venerdì sera fu rapido e il personale della reception spiegò tutti i servizi con chiarezza. Il check-out stamattina è stato altrettanto fluido. Esperienza senza alcuna sbavatura.;Reception;positive
284;Menu del ristorante sempre lo stesso;Per cinque sere consecutive il ristorante proponeva gli stessi tre piatti principali. La colazione variava appena di giorno in giorno. Il personale F&B era educato ma la qualità del cibo stagnava senza migliorare.;F&B;negative
285;Cammera disgustosa!! #puliziazero @hotelmanagement;Ma stiamo scherzando??!!! Trovai capelli sul cuscino e il WC MAI pulito dall'ospite precedente!! HO FOTOGRAFATO TUTTO e mandato mail alla direzione!! La ricetionist si scusò ma NON cambiò niente!! INACCETTABBILE!!$$;Housekeeping;negative
286;Le pulizie sono state impeccabili ma reception lenta;La pulizia camera era eccellente ogni mattina: dettagli curati e bagno sanificato puntualmente. Purtroppo il check-out aveva richiesto mezz'ora per un disguido con la fatturazione.;Reception;negative
287;Check-out rapido ma cibo pessimo;La reception gestì il check-out stamattina in meno di tre minuti: fattura corretta al primo colpo e personale cordiale. Purtroppo la colazione quella mattina era scadente come del resto la cena del giorno prima.;Reception;positive
288;Colazione strepitosa ma camera trascurata;Il ristorante a colazione era di altissimo livello ogni mattina: prodotti biologici freschi e personale F&B sorridente. La pulizia camera invece deludeva sistematicamente: bagno con residui e pavimento appiccicoso.;F&B;positive
289;Cibo mediocre ma pulizzie da manuale;La colazzione era appena sufficiente e il ristorante a cena non convinceva affatto: porzioni ridicole e servvizio lentissimo. La pulizia camera però compensava: impeccabile ogni giorno senza eccezioni.;F&B;negative
290;Standard pulizie finalmente migliorato;Due soggiorni fa la pulizia camera era nella media. Stavolta invece ho trovato un livello nettamente superiore: ogni angolo curato, bagno profumato e scorte di cortesia sempre rifornite puntualmente.;Housekeeping;positive
291;RICETIONIST SCOMPARSA!! ATTESA ASSURDA!!??;Qual'è il senso di una reception presidiata se la ricetionist sparisce per venti minuti?? Aspettai con i bagagli in mano mentre il taxi attendeva fuori!! Servvizio INDECENTE!!$$ #accogglienzzzapessima;Reception;negative
292;Menù serale del ristorante da consigliare;Non avevo pianificato di cenare in hotel ma il menù della sera mi ha convinto. Il ristorante ha proposto piatti regionali ben eseguiti e un personale F&B preparato e discreto. Tornerò volentieri.;F&B;positive
293;Lenzuola usurate;Le lenzuola del letto erano molto vecchie e leggermente strappate in un angolo. Il servizio di pulizia dovrebbe fare più attenzione.;Housekeeping;negative
294;Colazzione immangiabille!! *ROBA AVANZATA*;#scandalo Stamattina la colazzione comprendeva croissant DURI e succhi annacquati di bassa qualità!! Il ristoarnte aveva ancora le sedie sui tavoli alle otto!! Personale F&B COMPLETAMENTE ASSENTE!!$$ MAI PIÙ!!;F&B;negative
295;Accogglienzza al top dalla prima parola;Arrivai esausta dopo un lungo viaggio e la receptionist mi accolse con un sorriso genuino e un tono caldo. Il check-in fu completato in meno di tre minuti. Prima impressione eccellente.;Reception;positive
296;Camera trascurata dall'inizio alla fine;Durante il soggiorno di marzo scorso la pulizia cammera veniva eseguita ogni tre giorni in modo frettoloso. Il bagno presentava sempre aloni sullo specchio e asciugamani non cambiati nonostante le richieste.;Housekeeping;negative
297;Ristorante che non delude mai;Ogni pasto ha confermato lo stesso standard elevato: colazione ricca con prodotti di stagione e cena curata con piatti regionali ben eseguiti. Il personale F&B era sempre competente e cordiale.;F&B;positive
298;CHECK-IN DURATO UN'ETERNITÀ ASSURDA!!;Il check-in di ieri sera ha richiesto SESSANTA MINUTI perché la ricetionist aveva sbagliato la categoria di camera prenotata!! Nessun responsabile si è presentato a risolvere!! INACCETTABILE per questi prezzi!!$$;Reception;negative
299;Attenzione ai dettagli che fa la differenza;Ogni sera trovavo la camera perfettamente riassettata con piccoli tocchi che dimostravano cura genuina: scorte di cortesia rifornite, cuscini sistemati con precisione e bagno sempre impeccabile.;Housekeeping;positive
300;Esperienza culinaria sopra le aspettative;La colazione al mattino offriva prodotti freschi e locali in abbondanza. Il ristorante a cena confermava lo stesso livello con piatti curati e personale F&B attento e professionale per tutto il soggiorno.;F&B;positive
