id;title;body;department;sentiment
1;Camera impeccabile, soggiorno perfetto;La pulizia camera era davvero eccellente: lenzuola fresche ogni giorno e bagno sempre in ordine. Il personale di housekeeping si è dimostrato discreto e professionale.;Housekeeping;positive
2;Chekin velocissimo;Pur essendo arrivati tardi lla sera ,venimmo accolti con grande efficienza dai ragazzi presenti al momento.Il chekin e' durato pochissimo.;Reception;positive
3;Colazione abbondante e varia;Ogni mattina il buffet della colazione offre una selezione incredibile di prodotti freschi. Il ristorante è curato e il personale F&B è sempre sorridente.;F&B;positive
4;CAMERA MAI PULITA!!;Tre giorni di fila e la pulizia camera NON È STATA EFFETTUATA. Asciugamani sul pavimento, cestino pieno... INACCETTABILE per un hotel di questa categoria!!!;Housekeeping;negative
5;Problemi seri al check-out;Durante il check-out ci hanno addebitato servizi mai richiesti. Ho dovuto aspettare quaranta minuti per la correzione della fattura. Esperienza frustrante.;Reception;negative
6;Ristoante sotto ogni aspettativa;La cena al ristorante dell'hotel fu deludente: piatti freddi, porzioni minime e tempi di attesa esagerati. La colazione del giorno successivo non andò meglio. Agiungo che il personale al momento del servizio era molto distratto;F&B;negative
7;Housekeeping ECCELLENTE!!;Non avevo mai trovato una pulizia camera così accurata! #puliziaimpeccabile Ogni angolo era curato, i sanitari brillavano. COMPLIMENTI al reparto pulizie!!!;Housekeeping;positive
8;Receptionist gentilissima;Oggi il personale alla reception mi ha aiutato a organizzare un tour della città con grande disponibilità. Il check-in è stato rapido e piacevole.;Reception;positive
9;Colazione: che delusione...;La colazione era fredda e i prodotti da forno sembravano del giorno prima. Il ristorante poi aveva un odore strano... *PESSIMO* per il prezzo pagato.;F&B;negative
10;Soggiorno rovinato dallo sporco;Arrivammo in camera e trovammo i capelli del precedente ospite nella doccia. La pulizia camera era chiaramente stata fatta in fretta. Non torneremo.;Housekeeping;negative
11;Check-out rapido e senza stress;Il personale della reception ha gestito il check-out in modo impeccabile. Hanno anche chiamato il taxi per noi senza che lo chiedessimo. Servizio di alto livello.;Reception;positive
12;Buffet della colazione TOP;Stamattina ho fatto una colazione fantastica: frutta fresca, uova strapazzate calde, yogurt artigianale. Il ristorante merita davvero ogni elogio.;F&B;positive
13;Vamera non riassettata x 2gg!!;Ma stiamo scherzando??!!! La pulizia camera non è stata fatta per DUE GIORNI consecutivi!! Ho chiamato la ricetionist ma non è cambiato niente. #serviziozero $$$sprecati;Housekeeping;negative
14;Ottimo check-in, notte tranquilla;L'anno scorso in questo stesso hotel il check-in era lento e confuso. Quest'anno invece tutto è filato liscio: la reception ci ha assegnato la camera in pochi minuti.;Reception;positive
15;Cibo buono ma cameriere sgarbato;La qualità del cibo al ristorante era sorprendentemente buona, ma il servizio F&B lasciava molto a desiderare. Il cameriere sembrava infastidito da ogni nostra richiesta.;F&B;negative
16;FANTASTICO il servizio pulizie!!;Non me lo aspettavo a questo prezzo: la pulizia camera era PERFETTA ogni giorno, con piccoli origami di asciugamani sul letto. Esperienza da 5 stelle!!! #housekeepinggoals;Housekeeping;positive
17;Receptionist@hotel scortese;Qual'è il senso di avere una reception aperta 24h se il personale è maleducato?? Il check-in è durato 25 minuti per un ERRORE loro. Assurdo!!;Reception;negative
18;Colazione eccellente, ma camere trascurate;La colazione al ristorante era una vera gioia ogni mattina: prodotti locali, personale F&B attento e sorridente. Peccato che la pulizia camera fosse carente: trovammo residui sotto il letto.;F&B;positive
19;Camere pulite, ristorantino da evitare;La pulizia camera ci ha positivamente sorpresi: tutto profumava di fresco e i dettagli erano curati. Il ristorante però era un disastro: cibo scadente... *ORRIBILE* e servvizio lentissimo.;F&B;negative
20;Colazione ottima, front desk perfetto... quasi;Il personale della reception ci ha accolti con professionalità e il check-in è stato fluido. La colazione abbondante ha reso il mattino piacevole. Solo un neo: abbiamo atteso dieci minuti prima che qualcuno ci notasse al desk.;Reception;positive
21;Reception ok, ristorante assolutamente da rivedere;Arrivammo stanchi e la reception gestì il check-in rapidamente, ma la cena al ristorante quella stessa sera fu deludente: menu limitato e colazione il giorno dopo appena sufficiente.;Reception;negative
22;Servvizio pulizie nella norma;La pulizia camera era accettabile, niente di straordinario. Gli asciugamani venivano cambiati ogni due giorni e il pavimento era discretamente pulito. Nulla da segnalare.;Housekeeping;positive
23;CHECK-OUT UN DISASTRO TOTALE!!;Prezzo esagerato!!$$ e per giunta il check-out è durato UN'ORA perché il sistema della reception era in panne. NESSUNO si è scusato. MAI PIÙ in questo hotel @management!!;Reception;negative
24;Pulitooo e profumato!;Ogni volta che rientravo in camera dopo la spiaggia trovavo tutto in ordine: la pulizia camera era curata nei minimi dettagli. #soddisfatto Personale housekeeping davvero in gamba.;Housekeeping;positive
25;Ristorante buono, camere da rivedere;Il ristorante ci ha piacevolmente sorpresi: la colazione era ricca e la cena di ottimo livello, con piatti ben presentati. Tuttavia la pulizia camera era insufficiente: il bagno non sembrava essere stato sanificato correttamente.;F&B;positive
26;Finalmente una camera dignitosa;Quest'anno la pulizia camera ha migliorato rispetto alla mia visita precedente. Tutto era in ordine e gli asciugamani erano stati piegati con cura. Apprezzo l'attenzione ai dettagli.;Housekeeping;positive
27;RITARDO ASSURDO AL CHECK-IN!!;Aspettammo quarantacinque minuti in piedi alla ricezzione prima che qualcuno ci degnasse di attenzione. Il check-in era completamente disorganizzato. VERGOGNOSO per un hotel a 4 stelle!!;Reception;negative
28;Colazione da sogno stamattina;Oggi il buffet del ristorante è semplicemente magnifico: frutta di stagione, croissant caldi, formaggi locali. Il personale F&B è attento e premuroso. Tornerò solo per questo.;F&B;positive
29;Cammera non pulita nemmeno una volta;Durante i tre giorni di sogggiorno la pulizia zeroo era evidente: pavimento appiccicoso, specchio del bagno con aloni e cestino mai svuotato. Inaccettabile!!;Housekeeping;negative
30;Personale reception top;Oggi il check-out è stato rapidissimo: la receptionist ha stampato la fattura corretta al primo colpo e ci ha salutati con un sorriso. Piccoli gesti che fanno la differenza.;Reception;positive
31;Il ristoarnte lascia a desiderare;La cena al ristoarnte era fredda e insipida. La colazzione del mattino successivo non era da meno: succhi artificiali e brioche confezionate. Prezzo esagerato!!$$ per questa qualità.;F&B;negative
32;HOUSEKEEPING ECCEZIONALE stavolta!!;Non me lo aspettavo proprio: la pulizia cammera era PERFETTA, con i dettagli curati e un profumo fresco in ogni angolo. #impressionato Il miglior servvizio pulizie mai avuto!!;Housekeeping;positive
33;Check-in liscio, nessun problema;Arrivammo a mezzanotte passata e la reception era ancora operativa. Il check-in si concluse in pochi minuti. Il personale era stanco ma comunque professionale.;Reception;positive
34;Colazione sufficiente, nulla di più;La colazione offriva una selezione minima: pane, burro, marmellata industriale. Il ristorante era pulito ma privo di atmosfera. Mi aspettavo qualcosa di più da questo hotel.;F&B;negative
35;Sporco!! #puliziazero @hotelmanagement;Ma stiamo scherzando??!!! Trovai la vamera con i capelli sul cuscino e il WC non pulito. Ho contattato la ricetionist che si è scusata ma la situazione NON è migliorata. MAI PIÙ!!;Housekeeping;negative
36;Ristorante buono, ma personale della reception maleducato;La colazione al ristorante era genuinamente ottima: prodotti freschi e personale F&B sorridente. Purtroppo il check-in aveva richiesto quasi mezz'ora per un disguido con la prenotazione.;Reception;negative
37;Receptionist gentile, cibo pessimo;Il check-in oggi è filato liscio grazie a una receptionist davvero disponibile. Peccato che la cena al ristorante fosse scadente: piatti tiepidi e porzioni ridicole per il prezzo.;Reception;positive
38;Colazzione abbondante, camere perfette;Ogni mattina la colazzione era ricchissima e il ristorante curatissimo. La pulizia cammera era altrettanto impeccabile: trovavo sempre tutto in ordine al rientro. Soggiorno fantastico.;F&B;positive
39;F&B deludente, ma housekeeping ottimo;Il ristorante ci ha delusi profondamente: cibo scadente e servvizio lento durante la colazione. Tuttavia la pulizia camera era eccellente e ha reso il soggiorno tollerabile.;F&B;negative
40;Reception PERFETTA ma colazione orribile;Il team della reception ha gestito il check-in e check-out in modo ESEMPLARE, rapido e cordiale. Al contrario il ristorante era una delusione totale: la colazione sembrava roba *RISCALDATA* del giorno prima.;Reception;positive
41;Servizio pulizie nella media;La pulizia camera era accettabile: niente di straordinario ma nemmeno niente di cui lamentarsi. Gli asciugamani venivano sostituiti regolarmente e il bagno era decente.;Housekeeping;positive
42;RICETIONIST MALEDUCATA!!$$;Qual'è il problema di sorridere?? La tipa alla ricezzione era scocciata fin dal check-in. Tono scortese, nessuna spiegazione sui servizi. Prezzo esagerato per questo tratamento!!;Reception;negative
43;Buffet mattutino strepitoso;L'anno scorso la colazione era appena sufficiente. Quest'anno invece il ristorante ha completamente cambiato marcia: selezione ampia, tutto freschissimo e personale F&B davvero ospitale.;F&B;positive
44;Pulizia zeroo, vergogna!!;#schifoso La pulizia camera era INESISTENTE: macchie sul copriletto, doccia con residui di calcare e pavimento non lavato. TUTTO SPORCO!!! Ho dovuto pulire da solo prima di dormire.;Housekeeping;negative
45;Check-out gestito male;Stamattina il check-out è durato un'eternità: il sistema della reception era lento e il personale sembrava non sapere come rimborsare un servizio non fruito. Situazione risolta solo dopo trenta minuti.;Reception;negative
46;Pulizzia insufficiente, personalle poco professionale;L'anno scorso le camere erano discrete, ma questa volta la pulizia della camera è stata carente con polvere evidente.Mi chiedo se effettivamente il personalle delle pulizzie sia presente oppure no!!;Housekeeping;negative
47;Ristoranttee assolutamente da evitare, mamma mia;Cibo scadente... *ORRIBILE*. La colazzione era un disastro: caffè annacquato, brioche dure e frutta avaizzata. Il ristorante non vale assolutamente il prezzo richiesto. #cibopessimo;F&B;negative
48;Reception efficiente e discreta;Oggi il personale alla reception mi ha consegnato le chiavi in meno di tre minuti. Nessuna fila, nessun intoppo. Il check-in più veloce che abbia mai vissuto in un hotel italiano.;Reception;positive
49;Colazione ottima, pulizia sufficiente;Il ristoarnte a colazione offriva una selezione genuina di prodotti locali e il personale F&B era premuroso. La pulizia cammera invece era nella media: accettabile ma senza quella cura in più che ci si aspetta.;F&B;positive
50;CAMERA OK ma colazzione ORRENDA!!;La pulizia camera era buona, devo ammetterlo: tutto in ordine e bagno profumato. Però la colazzione al ristorante era *IMMANGIABILE*: uova strapazzate fredde e succhi scaduti??!!! #colazzionehorror;F&B;negative
51;Tre notti da sogno grazie agli addetti delle pulizie;Ogni sera rientravo in una camera impeccabile: lenzuola tese, bagno profumato e asciugamani cambiati puntualmente. La pulizzzia camera ha reso il soggiorno davvero piacevole.;Housekeeping;positive
52;CHECKOUT IMPOSSIBILE!!$$;Stamattina il check-out è stato un INCUBO: la ricetionist non riusciva a trovare la mia prenotazione e ho aspettato 40 minuti in piedi. Ma stiamo scherzando??!!! #serviziozero;Reception;negative
53;Risotto al ristorante da standing ovation;Ieri sera la cena al ristorante mi ha sorpreso: piatti curati, ingredienti freschi e personale F&B attento senza essere invadente. La colazione stamattina ha confermato l'ottima impressione.;F&B;positive
54;Pulizia zeroo in tutta la cammera;#disgustoso Trovai il pavimento appiccicoso, il water non pulito e residui di sapone nel lavandino. La pulizia cammera era semplicemente INESISTENTE. Chiesi spiegazioni ma nessuno rispose.;Housekeeping;negative
55;Personale al front desk eccellente;Oggi il check-in è durato tre minuti esatti: la receptionist ci ha spiegato tutti i servizi con chiarezza e gentilezza. Raramente ho trovato una reception così ben organizzata.;Reception;positive
56;Colazzione fredda e personale assente;La colazzione era deludente: caffè tiepido, cornetti duri e nessun prodotto fresco. Il ristorante era semivuoto eppure il personale F&B impiegava minuti a rispondere. Prezzo esagerato!!$$;F&B;negative
57;PULIZIA FANTASTICA!!! #topdellastars;Non credevo ai miei occhi: la pulizia camera era PERFETTA ogni singolo giorno!! Asciugamani piegati a forma di cigno, pavimento BRILLANTE. Il miglior housekeeping mai visto!! @hotelmanagement bravi!!;Housekeeping;positive
58;Check-in notturno gestito bene;Arrivammo in tarda serata, stanchi e affamati. La reception era operativa e il check-in fu sbrigato in pochi minuti. Il personale fu cordiale nonostante l'ora tarda.;Reception;positive
59;Menù ristorante troppo limitato;La sera il ristorante offriva solo quattro piatti principali, tutti abbastanza anonimi. La colazione era leggermente migliore ma comunque sotto le aspettative per la categoria dell'hotel.;F&B;negative
60;Cammera sporca, ricetionist inutile!!;Segnalai la cammera sporca alla ricetionist che promise di mandare qualcuno. NESSUNO arrivò. Tornai alla reception e mi dissero che l'housekeeping era già andato via. ASSURDO!!;Housekeeping;negative
61;Colazione TOP, la reception per caso esiste??;Il buffet della colazione era genuinamente eccellente: prodotti locali, frutta fresca e personale F&B cordiale. Peccato che il check-in avesse richiesto mezz'ora per un errore nel sistema.;Reception;negative
62;Check-in perfetto, Risstorante pessimissimo;La reception ci ha accolti con professionalità e il check-in filò liscissimo. Tuttavia la cena al rristorante fu una delusione totale: cibo scaldato e colazione il giorno dopo appena sufficiente.;Reception;positive
63;Ristorante ottimo, camere lasciate a metà;La colazione al ristorante era ricchissima e il personale F&B davvero gentile. Purtroppo la pulizia camera era carente: trovammo il bagno con macchie evidenti e il pavimento non lavato.;F&B;positive
64;Ristorante e mangiare deludente, ma pulizie e camera ok!;Il ristorante ci deluse sia a colazione che a cena: cibo mediocre e servvizio lento. Fortunatamente la pulizia camera compensava: impeccabile ogni giorno, con ogni dettaglio curato.;F&B;negative
65;Espereinza rovinata dalla sporcizia;#inaccettabile La pulizia cammera era una vergogna: macchie sul copriletto, specchio del bagno opaco e cestino traboccante. TUTTO SPORCO!!! Ho dovuto chiamare tre volte prima che intervenissero.;Housekeeping;negative
66;Buffet mattutino da applausi;Stamattina mi sono seduto al ristorante aspettandomi il solito buffet anonimo. Invece: frutta fresca tagliata al momento, uova preparate su richiesta e personale F&B sorridente. Ottima sorpresa!;F&B;positive
67;RICETIONIST SCORTESE SENZA MOTIVO!!;Qual'è il problema di rispondere a una semplice domanda?? La tipa alla ricezzione mi ha risposto male sia al check-in che al check-out. Atteggiamento INACCETTABILE!!$$ #frondeskchaos;Reception;negative
68;Presenza di polvere, stanza non come in foto;Siamo arrivati in stanza e abbiamo notato un forte strato di polvere sopra l'armadio e sotto il letto. Peccato per la disattenzione. Da annotare che la stanza a mio avviso non corrispondeva alla realtà.;Housekeeping;negative
69;Colazzione immangiabbile *ORRENDA*;Ma cos'era quella roba sul buffet stamattina?? La colazzione comprendeva succhi scaduti e croissant immangiabbile. Il ristorante puzzava anche di chiuso. Prezzo esagerato!!$$ #colazzionehorror;F&B;negative
70;Receptionist competente e disponibile;Oggi ho chiesto informazioni sui trasporti alla reception e ho ricevuto una risposta dettagliata e precisa. Il check-in era già stato rapido ieri sera. Personale davvero professionale.;Reception;positive
71;Tutto in ordine, nessuna lamentela;La pulizia camera era regolare durante tutto il soggiorno. Niente di straordinario ma tutto funzionava: asciugamani freschi, letto rifatto ogni giorno e bagno decente. Soddisfatto.;Housekeeping;positive
72;Servvizio ristoarnte lentissimo;Aspettammo quasi un'ora per un secondo piatto al ristorante. La colazione del mattino seguente fu gestita meglio ma il caffè era annacquato. Il personale F&B sembrava sopraffatto.;F&B;negative
73;Chekout lentissiximo con sorpresa SPIACEVOLE!;Al checkout mi presentarono un conto con addebiti mai autorizzati. La receptionista ci mise venti minuti a correggere l'errore e nessuno si scusò. Comportamento poco professionale.;Reception;negative
74;Direi tutto  da manuale;L'anno scorso in questo hotel la pulizia camera lasciava a desiderare. Stavolta invece ogni mattina trovavo la stanza perfettamente riassettata, con i dettagli curati e un profumo gradevole.;Housekeeping;positive
75;Ristorante discreto, check-in ottimo;Il personale della reception gestì il check-in con rapidità e professionalità nonostante l'affollamento serale. Il ristorante a cena era discreto: la colazione abbondante ma senza grandi guizzi.;F&B;positive
76;Bagno non curato;La doccia presentava evidenti tracce di muffa sulle piastrelle e il lavandino perdeva acqua dal sifone.;Housekeeping;negative
77;FILA INTERMINABILE AL CHECK-IN!!;Aspettai quaranta minuti davanti al bancone della reception mentre due ricetionist litigavano tra loro. Il check-in era DISORGANIZZATO e nessuno si scusò. #frontdeskfail MAI PIÙ!!;Reception;negative
78;Pranzo al ristorante da incorniciare;Oggi a pranzo il ristorante ha espresso il meglio: antipasti freschi, pasta fatta in casa e personale F&B attento. La colazione stamattina era già stata ottima. Due su due.;F&B;positive
79;Lenzuola macchiate, bagno non sanificato;Aprimmo la vamera e trovammo subito macchie evidenti sul copriletto. La pulizia cammera era stata chiaramente saltata. Segnalai tutto alla ricetionist che mandò qualcuno solo dopo due ore.;Housekeeping;negative
80;Receptionist paziente e disponibile;Oggi ho avuto un problema con la chiave magnetica e il personale della reception l'ha risolta in meno di due minuti con il sorriso. Piccoli gesti che rendono il soggiorno piacevole.;Reception;positive
81;Colazzione scarsa e mal presentata;Il buffet della colazzione offriva prodotti scadenti disposti in modo sciatto. Il ristorante era rumoroso e il personale F&B sembrava non curarsi degli ospiti. Delusione totale.;F&B;negative
82;CAMERA IMPECCABBILE OGNI GIORNO!!!;#housekeepingtop Il servizio pulizie era STRAORDINARIO: pavimento BRILLANTE, telo da bagno piegato a ventaglio e scorte rifornite puntualmente. Esperienza da 5 stelle!! @hotelmanagement ottimo lavoro!!;Housekeeping;positive
83;Nessuna attesa al check-out stamattina;Il check-out di oggi è stato il più rapido della mia vita da viaggiatore: fattura corretta, bagagli custoditi senza problemi e taxi chiamato spontaneamente. Reception al top.;Reception;positive
84;Menu fisso e monotono al ristorante;Durante i quattro giorni di soggiorno il ristorante proponeva sempre gli stessi piatti. La colazione variava appena. Il personale F&B era gentile ma la qualità del cibo restava bassa.;F&B;negative
85;Sporcizzia ovunque!! #schifo$$;Ma stiamo scherzando??!!! La pulizia zeroo era evidente già all'ingresso: pavimento appiccicoso, specchio del bagno con aloni e un capello nella doccia. TUTTO SPORCO!!! Vergogna!!;Housekeeping;negative
86;Ottimo ristorante, reception da migliorare;La colazione al ristorante era eccellente e il personale F&B ci ha viziati ogni mattina con prodotti freschi. Purtroppo il check-in aveva richiesto mezz'ora per un errore di prenotazione.;Reception;negative
87;Check-in rapido, ristorante deludente;La reception ci ha accolti brillantemente: check-in immediato e personale sorridente. Al contrario la cena al ristorante fu mediocre e la colazione del giorno dopo era appena sufficiente.;Reception;positive
88;Ristorante eccellente, pulizia camera insufficiente;La colazione al ristorante era di altissimo livello: prodotti biologici, caffè aromatico e personale F&B premuroso. Peccato che la pulizia camera fosse trascurata: bagno con residui e pavimento non lavato.;F&B;positive
89;Ristorante pessimo ma governante e pulizia da applausi;Il ristorante ci ha deluso a ogni pasto: colazzione scadente e cena fredda. La pulizia camera però era meticolosa ogni giorno e ha reso il soggiorno sopportabile.;F&B;negative
90;Qualità housekeeping calata rispetto all'anno scorso;L'anno scorso la pulizia camera era il punto di forza di questo hotel. Stavolta invece abbiamo trovato il bagno con aloni sullo specchio e asciugamani non cambiati per due giorni.;Housekeeping;negative
91;Ristorante consigliato senza riserve;Stamattina la colazione era talmente buona da convincermi a fermarmi anche per il pranzo. Il ristorante offre un'atmosfera piacevole e il personale F&B è formato e cortese.;F&B;positive
92;RICETIONIST INCOMPETENTE!!??;Qual'è il senso di prenotare online se poi al check-in la ricetionist non trova la PRENOTAZIONE??!!! Ho aspettato 35 minuti in piedi. Servvizio ZERO!! #receptionfail @direzionealbergo;Reception;negative
93;Soggiorno senza intoppi grazie all'housekeeping;Durante il weekend appena trascorso ho apprezzato la costanza del servizio pulizie. La pulizia camera era garantita ogni mattina entro le undici, senza mai mancare.;Housekeeping;positive
94;Colazzione immangiabille *SCHIFO*;Che delusione stamattina: la colazzione era composta da prodotti confezionati di bassa qualità. Il ristorante era sporco e il caffè aveva un sapore strano. Prezzo esagerato!!$$ #ciboimmangiabile;F&B;negative
95;Rapidità e cortesia al bancone e tanto divertimento;Oggi il personale alla reception ha gestito simultaneamente cinque check-in senza perdere la calma. Ogni ospite è stato accolto con professionalità. Davvero un ottimo front desk. Mi sono divertito tanto durante questa vacanza;Reception;positive
96;Pulizia nella norma, nulla da segnalare;La pulizia camera era regolare e senza sorprese negative. Gli asciugamani venivano sostituiti ogni due giorni e il bagno mantenuto decentemente. Soggiorno nella media.;Housekeeping;positive
97;Cibo tiepido e servvizio lento;Ordinammo due piatti al ristorante e aspettammo quaranta minuti. Quando arrivarono erano tiepidi e mal conditi. La colazzione del mattino seguente non fu da meno. Personale F&B svogliato.;F&B;negative
98;Nessun problema durante il soggiorno;Il check-in e il check-out sono stati gestiti in modo scorrevole. La reception era sempre presidiata e ogni richiesta veniva evasa rapidamente. Esperienza senza sbavature.;Reception;positive
99;Odore strano in cammera dal primo giorno;Fin dal momento in cui entrammo nella cammera sentimmo un odore sgradevole. La pulizia camera era superficiale e nonostante la segnalazione fatta piu' volte, il problema non fu mai risolto. ;Housekeeping;negative
100;Personale e camerieri gentili e ristorante curato;La colazione era abbondante e il ristorante offriva un ambiente elegante e pulito. Il personale F&B ci ha coccolati durante tutto il soggiorno. Torneremo sicuramente per questo.;F&B;positive
101;Camera non riordinata, zero cura;Oggi siamo rientrati in struttura nel tardo pomeriggio e nessuno era passato per il rifacimento dei letti.;Housekeeping;negative
102;ATTESA INSOSTENIBILE ALLA RECEPTION!!;Arrivai dopo un lungo viaggio e trovai una fila di dieci persone con UN SOLO ricetionist al bancone. Il check-in durò cinquanta minuti. SCANDALOSO per un hotel di questa fascia!!$$;Reception;negative
103;Sapori autentici al ristorante, davvero inclusivo;Ieri sera la cena al ristorante mi ha conquistato: ingredienti locali, porzioni generose e un dessert fatto in casa memorabile. La colazione stamattina era altrettanto curata.Devo dire tantissima la qualià in questo posto;F&B;positive
104;Vamera mal pulita e odori sgradevoli;Entrammo nella vamera e notammo subito un odore stantio. La pulizia cammera era stata fatta in fretta: polvere sui comodini e residui di sapone nel box doccia. Inaccettabile.;Housekeeping;negative
105;Front desk cordiale e reattivo;Stamattina ho chiesto alla reception di spostare il check-out di due ore e la risposta è stata immediata e positiva. Personale davvero disponibile e professionale.;Reception;positive
106;Colazzione raffazzonata e fredda;Il buffet della colazzione era allestito in modo sciatto: succhi di frutta annacquati, croissant immangiabili e nessun prodotto caldo. Il ristorante sembrava abbandonato a se stesso.;F&B;negative
107;HOUSEKEEPING DA 10 E LODE!!!;#puliziaperfetta La pulizia camera era STRAORDINARIA: ogni angolo brillava, i cuscini erano sistemati con cura e trovai persino un cioccolatino sul letto!! Personale ECCEZIONALE!! @gestionehotel bravi!!;Housekeeping;positive
108;Nessun intoppo durante tutto il soggiorno;Il check-in e il check-out sono filati lisci entrambi. La reception era sempre presidiata e il personale rispondeva a ogni richiesta con competenza. Esperienza molto positiva.;Reception;positive
